,Name,City,Cuisines,Average Cost,Aggregate Rating
4725,Clay 1 Grill,Oklahoma City,"Cafe, Seafood",13,3.6
4726,Firangi Island,Iron Mountain,"Desserts, Tea, Italian, BBQ, Fast Food",13,3.5
4727,Jeet Chaat Bhandar,Portland,"Tea, Cafe",77,3.5
4728,Mr. Grill,Twin Falls,"BBQ, Cafe, American, Desserts",80,3.6
4729,Tikka Junction,Dallas,"Tea, Bakery, Fast Food, Cafe, American, Mediterranean",86,3.5
4730,Momos Hut & Chinese Food,San Diego,"Tea, Cafe, Fast Food",94,2.4
4731,Wah Ji Wah,Oklahoma City,"Desserts, Pizza, Italian, Bakery, Cafe",99,2.1
4732,Yo! China,Minot,"Tea, Chinese, BBQ, Desserts",43,2.4
4733,Aapki Apni Rasoi,St. Petersburg,"French, Pizza, Indian, BBQ",20,2.9
4734,Aapki Rasoi,Detroit,"Mediterranean, Desserts, Seafood",21,3.0
4735,Advance Bakery,Rockford,"Desserts, Pizza, Mexican, Bakery, Chinese, Seafood",100,2.9
4736,Apni Rasoi,Grand Island,"Desserts, Pizza, BBQ, Fast Food, Indian",93,2.9
4737,Bakeyard,Billings,"Tea, BBQ, Cafe, Mediterranean, Seafood",74,3.0
4738,Bharat Chicken Inn Foods,Santa Fe,"Pizza, Mediterranean, Desserts",38,2.9
4739,Bobby Veg Corner,Bishop,"Seafood, Pizza, Fast Food",59,2.9
4740,Brunch Point,Sun Valley,"Tea, Cafe, BBQ, Seafood",63,2.9
4741,Bunty Dhaba,Bozeman,"Indian, Desserts, Fast Food",55,2.5
4742,Chandni Chowk Ka Sonu Parathe Wala,Scranton,"Fast Food, Chinese, Desserts, Seafood",16,3.1
4743,Chankya,Norfolk,"Bakery, Fast Food",42,3.2
4744,Chaudhary Di Hatti,San Diego,"Desserts, Pizza, Italian, BBQ, Fast Food",30,3.3
4745,Cook Du Kdu,Baltimore,"Desserts, Pizza, BBQ, Cafe, Indian",86,3.2
4746,Daawat Restaurant,Williston,"Desserts, Tea, French, BBQ, Fast Food",68,3.3
4747,Delhi Dairy,Phoenix,"Seafood, Cafe, Fast Food",23,3.2
4748,Domino's Pizza,Grand Rapids,"Seafood, BBQ, Desserts, Italian",34,2.9
4749,Domino's Pizza,Santa Fe,"Tea, Pizza, Desserts",100,3.1
4750,F 2 Pastry Shop,Great Falls,"Tea, Pizza, Indian, Desserts",49,3.3
4751,Food Villa,Medford,"Fast Food, Mediterranean, Seafood",21,2.9
4752,Goosebumps,New York,"Chinese, Pizza, Bakery",94,3.2
4753,Gulab,Duluth,"Cafe, American, BBQ, Italian",59,3.3
4754,Health Buzzz,Cedar Rapids,"Fast Food, Mediterranean, Desserts, Seafood",13,3.1
4755,Jain Dhaba,Eau Claire,"Pizza, Italian, BBQ, Fast Food, Indian, Seafood",82,3.2
4756,Jeeta Kulfi Walle,Niagara Falls,"Cafe, Mediterranean, Desserts",51,3.3
4757,Kamal Meat House,Salisbury,"Fast Food, BBQ, Italian",93,2.6
4758,Katyani Rasoi,Oakland,"Tea, French, Bakery, BBQ, Indian, Seafood",34,3.2
4759,Magic Masala,Pittsburgh,"French, Bakery, BBQ, Fast Food, Cafe",90,3.0
4760,Masala Magic,Nantucket,"Desserts, Pizza, French, BBQ, Bakery",69,3.0
4761,Mother Sweets,Toledo,"Seafood, Indian, Fast Food",24,3.4
4762,Panj Taara,Prescott,"Bakery, American, Seafood",30,3.1
4763,Prince Fried N Grilled Chicken,Scottsbluff,"Desserts, Tea, Pizza, Italian, BBQ, Chinese",21,2.7
4764,Punjabi's Veg Grill,Jamestown,"BBQ, American, Desserts",89,3.1
4765,Raja Chat Corner,Shreveport,"Cafe, American, Mediterranean, Desserts",82,3.3
4766,Rajshree,Branson,"Mexican, Bakery, Desserts, Seafood",14,3.3
4767,Sachdeva Chicken Corner,Asheville,"Cafe, Mexican, Pizza, Italian",52,3.4
4768,Shree Rathnam,Anchorage,"Cafe, BBQ, Mediterranean, Seafood",82,2.9
4769,Sialkot,Pensacola,"Chinese, Bakery, Seafood",66,3.1
4770,Singh-O-Singh Kebabs,San Jose,"Tea, BBQ, Fast Food, Mediterranean, Seafood",53,3.1
4771,Super Snacks,St. Petersburg,"Pizza, Italian, French, BBQ, Cafe, Seafood",72,3.1
4772,Tandoori Night,Branson,"Tea, Pizza, Fast Food",60,3.1
4773,The Chaupal Bar And Restaurant,Santa Fe,"Mexican, Pizza, Mediterranean, Seafood",59,2.9
4774,The Grill Point,Montgomery,"Cafe, Bakery, Mediterranean",96,3.0
4775,The Roll Hut,Pago Pago,"Desserts, French, Bakery, Fast Food, Cafe, Indian",64,3.1
4776,Triveni,Lansing,"Desserts, Mexican, Bakery, BBQ, Mediterranean, Seafood",37,3.2
4777,Gokul Foods,Presque Isle,"BBQ, Mediterranean, Seafood",16,3.6
4778,Papa Pizza,Las Vegas,"Cafe, Pizza, BBQ",38,3.5
4779,Aalishaan,Evansville,"Tea, French, Bakery, Cafe, American, Seafood",71,0.0
4780,Amritsari Chaat Bhandar,Provo,"Tea, Pizza, French, Mexican, Cafe",82,0.0
4781,Bansal Foods,Belleville,"Chinese, Pizza, Cafe, Fast Food",68,0.0
4782,Bhatia Chinese Food,Burbank,"Tea, Bakery, American, BBQ",67,0.0
4783,Break Fast Junction,Stockton,"Fast Food, Pizza, Bakery, Italian",46,0.0
4784,Breakfast Hut,Huntsville,"Cafe, Bakery, Desserts, Seafood",81,0.0
4785,Buddy 's. Pizza,Niagara Falls,"Tea, BBQ",50,0.0
4786,Chai Garam,Charlotte Amalie,"Desserts, Tea, French, Mexican, Cafe, Seafood",50,0.0
4787,Deepu Fish & Chicken,Traverse City,"Tea, Cafe, American, BBQ",49,0.0
4788,deliKitchen,Belleville,"Seafood, BBQ, Fast Food",64,0.0
4789,Dial A Cake,Rockford,"Cafe, American, Mediterranean, Desserts",29,0.0
4790,Fuel Diet Cafe,Hilo,"Tea, Desserts, Pizza, BBQ",89,0.0
4791,GO CHATZ With Breadz,Los Angeles,"Cafe, Bakery, Pizza, Desserts",55,0.0
4792,Goldy Chat Bhandar,Ogdensburg,"Tea, Bakery, Seafood",83,0.0
4793,Green Chick Chop,Lewisburg,"Bakery, Desserts",59,0.0
4794,Hungry Heights,Santa Barbara,"Tea, Pizza, Italian, French, BBQ",32,0.0
4795,Kebabish,Wilmington,"Desserts, Italian, BBQ, Cafe, Indian, Seafood",64,0.0
4796,Khalsa Dhaba,Reno,"Chinese, Bakery, Indian, Fast Food",100,0.0
4797,Khanna's Hot Pizza,Houston,"Pizza, Mediterranean, Desserts, Fast Food",80,0.0
4798,Lets Eat Veg,Worcester,"French, Pizza, Desserts",68,0.0
4799,Mitra Da Dhabha,Waco,"Cafe, Seafood, Mediterranean, Fast Food",68,0.0
4800,Murliwala Bakers,Omaha,"Desserts, Tea, Italian, BBQ, Cafe",27,0.0
4801,Panjabi Chic-Shoppe,Wrangell,"Cafe, Pizza, Bakery, Seafood",54,0.0
4802,Raj Petha Bhandar,Valdosta,"Cafe, Fast Food",95,0.0
4803,Ramlal Sweets,Sioux City,"Bakery, Mexican, Pizza, Desserts",89,0.0
4804,Sanjha Chula Baba Da,Worcester,"Chinese, BBQ, Desserts, Seafood",47,0.0
4805,Sri Krishna,Salisbury,"Pizza, BBQ, Seafood",85,0.0
4806,Sugandh Corner,Kodiak,"Italian, Mexican, BBQ, Fast Food, Cafe, Seafood",51,0.0
4807,The Friends Cafe,Charlottesville,"Desserts, Pizza, American, Mediterranean, Seafood",62,0.0
4808,The Muffin Girl,Sioux Falls,"Mexican, Mediterranean, Desserts, Fast Food",36,0.0
4809,Rainbows,Paducah,"Chinese, Desserts, Seafood",36,3.1
4810,The Nest,San Angelo,"Tea, BBQ, Fast Food",25,3.5
4811,Burger Head Quarter BHQ,Johnstown,"Desserts, Tea, BBQ, Indian, Seafood",60,0.0
4812,Chez Jerome - Q Cafe,Bellingham,"Mexican, Indian, Desserts, Pizza",10,0.0
4813,Mr. Billiken,Anchorage,"Tea, American, Desserts, Seafood",81,0.0
4814,Mulligan Cafe,Los Angeles,"Tea, Mexican, BBQ, Fast Food, Indian",100,0.0
4815,Naya Adda,North Bend,"Seafood, Pizza, Fast Food",68,0.0
4816,OCD - Online Cake Delivery,Jacksonville,"Cafe, American, Desserts, Fast Food",34,0.0
4817,Puja Sandwich House,Jacksonville,"French, Cafe, Desserts",71,0.0
4818,Ambersari Dhaba,West Yellowstone,"Tea, Pizza, Italian, BBQ, Seafood",70,3.4
4819,Arabian Knites,Hattiesburg,"Tea, Pizza, French, Mexican, Fast Food, Seafood",38,3.0
4820,Aryan's Rajasthani Pyaz Ki Kachori,New York,"Cafe, Pizza, Indian, Seafood",17,3.1
4821,Aviram's Chinese Kitchen,Aguadilla,"Cafe, Mexican, Pizza, Fast Food",58,2.7
4822,Bhagwan Sweets,San Juan,"Desserts, Tea, Pizza, Italian, Fast Food, Mediterranean",96,2.8
4823,Chawla,Decatur,"Bakery, American, Fast Food",45,2.7
4824,Chinese Hut,West Yellowstone,"Cafe, Chinese, Bakery, Mediterranean",26,3.2
4825,Flavourz,Saipan,"Tea, Bakery, BBQ",24,3.3
4826,Lets Bake Love,Kalispell,"French, Bakery, Seafood",92,3.0
4827,Mahadev Dhaba,Birmingham,"French, Pizza, American, Bakery",80,2.6
4828,Sethi's Food Corner,Charleston,"Tea, Pizza",61,3.3
4829,Sethi's Restaurant,St. Petersburg,"French, Mexican, Pizza, BBQ",86,3.4
4830,Sindhi Kulfi,Abilene,"Pizza, French, BBQ, Fast Food, Cafe",37,3.0
4831,Sri Kamakshi Vilas,Sarasota,"Tea, BBQ, Bakery, Fast Food, Indian, Mediterranean",20,2.7
4832,The Midnight Hub - C,Pensacola,"Tea, Pizza, Bakery, BBQ, Chinese",32,2.6
4833,Anand Ji,West Palm Beach,"Tea, Cafe, BBQ, Fast Food",57,3.8
4834,Happy Hakka,White Plains,"Desserts, Pizza, Fast Food, Chinese, Seafood",37,3.7
4835,Oberoi's,Jacksonville,"Mexican, Pizza, Seafood",75,3.6
4836,Relax Restaurant,Fort Wayne,"Cafe, BBQ, Seafood",35,3.5
4837,Al-Rihan,Bishop,"Bakery, Pizza, BBQ, Fast Food",57,0.0
4838,All Day 99,Hilo,"Desserts, Pizza, Bakery, Fast Food, Mediterranean",37,0.0
4839,Anna Dosa,Charleston,"Desserts, Pizza, Mexican, BBQ, Cafe",84,0.0
4840,Chick Chicken House,Bristol,"Desserts, Cafe, Pizza, Bakery, Chinese",19,0.0
4841,Chicken King,Santa Rosa,"Pizza, Mexican, BBQ, Fast Food, American",12,0.0
4842,Choco Kraft,Manhattan,"Tea, Cafe, Italian",81,0.0
4843,Cocoalicious Delights,Ogdensburg,"Tea, Pizza, American, BBQ",56,0.0
4844,FNV,Honolulu,"Desserts, Tea, Bakery, Cafe, Mediterranean",90,0.0
4845,Food En Vouge,La Crosse,"Chinese, French, Bakery, Cafe",45,0.0
4846,Food Junction,Hyannis,"Desserts, Italian, BBQ, Bakery, Fast Food",94,0.0
4847,Gian Ji Punjabi Dhaba,Pittsburgh,"Tea, Cafe, Pizza, Fast Food, Chinese",19,0.0
4848,Govinda,Wichita,"Chinese, Pizza, Bakery, Italian",43,0.0
4849,Intermission,Bristol,"Cafe, Pizza, American",77,0.0
4850,Karma Cafe & Lounge,Tulsa,"Cafe, Mexican, Desserts",68,0.0
4851,Lotes Bakes,Charlotte,"BBQ, Bakery, Desserts, Seafood",29,0.0
4852,New Anna Ka Dosa,Kodiak,"Chinese, Mexican, BBQ, Fast Food",12,0.0
4853,New Sethi's,Twin Falls,"Tea, Seafood, Mexican, Italian",10,0.0
4854,Punjab Sweets,Fort Wayne,"Tea, Bakery, BBQ, American, Seafood",67,0.0
4855,Shri Ram Dhaba,Bloomington,"Pizza, Italian, Mexican, Bakery, Fast Food, Cafe",99,0.0
4856,Standard Punjabi Food,Salisbury,"Pizza, Fast Food",37,0.0
4857,Sunrise Bakery,Fort Lauderdale,"Pizza, Bakery, BBQ, Seafood",56,0.0
4858,Taste of Spice,Alexandria,"Pizza, Desserts, Seafood",52,0.0
4859,The Celiac Kitchen,El Paso,"Desserts, Tea, French, BBQ, Fast Food",22,0.0
4860,Aggarwal Sweet Corner,Wilmington,"Tea, Pizza, Italian",66,3.4
4861,Behrouz Biryani,Pellston,"Fast Food, Mexican, Desserts, Seafood",77,3.0
4862,Biryani Blues,Saginaw,"Pizza, French, BBQ, Fast Food, Mediterranean, Seafood",41,3.1
4863,Burger King,Yakima,"Pizza, Mediterranean, Fast Food",98,3.4
4864,Domino's Pizza,Killeen,"Chinese, Bakery, BBQ, Fast Food",97,2.5
4865,Gopal (Sindhi) Restaurant,Key West,"Desserts, Mexican, Bakery, BBQ, Fast Food",95,3.4
4866,Kabul Delhi,Harrisburg,"Cafe, Bakery, Mediterranean",71,2.9
4867,Khan Chacha,Roanoke,"Desserts, Tea, French, Mexican, Cafe, Seafood",84,2.9
4868,Pizza Hut Delivery,Fairbanks,"Desserts, Tea, Pizza, Italian, French, Fast Food",63,2.8
4869,Punjabi Jaika,Shreveport,"Mexican, BBQ, Desserts, Seafood",13,3.3
4870,Rozy Restaurant,Staunton,"Pizza, American, Bakery, BBQ, Indian, Seafood",49,2.6
4871,Taj Cafe,Houston,"French, BBQ, Seafood",18,3.1
4872,Tewari Sweets,Dothan,"Desserts, Pizza, French, BBQ, Fast Food",10,3.1
4873,The Burger Hut & Cake Shop,Missoula,"Pizza, Bakery, BBQ, American, Seafood",39,3.0
4874,Angel's Basket,Greensboro,"Cafe, BBQ",67,3.5
4875,Bikanervala,Austin,"Cafe, BBQ, Mediterranean, Fast Food",87,3.7
4876,Haldiram's,Syracuse,"Tea, French, BBQ, Cafe",43,3.8
4877,Moon of Taj,Pittsburgh,"Pizza, BBQ, Bakery, Cafe, Mediterranean",44,3.8
4878,Tongue Thai'd,Madison,"Bakery, Pizza, American, Fast Food",78,3.7
4879,Udupi Sai Sarover,Arcata,"French, Bakery, Chinese, Fast Food",56,3.8
4880,Wagh Bakri Tea Lounge,Aguadilla,"Cafe, BBQ, Seafood",32,3.5
4881,K2 Multi Cuisine Restaurant,Jamestown,"Tea, Cafe, Seafood",89,0.0
4882,Tibet Kitchen,Owensboro,"Cafe, Pizza, BBQ, Seafood",49,3.5
4883,Baba Nagpal Corner,Oklahoma City,"Tea, Chinese, Bakery, Seafood",11,4.1
4884,Burger Street,Oklahoma City,"Mexican, Bakery, BBQ",85,3.4
4885,Dilli Zaika,Lewiston,"Seafood, Pizza, BBQ, Fast Food",97,3.2
4886,Mughal Chic Inn,Ponce,"American, Desserts, Seafood",15,3.3
4887,Nutrition Theka,Dallas,"Pizza, American, Fast Food",77,3.3
4888,Punjabi Chaap Corner,Binghamton,"French, Cafe, Seafood",12,3.1
4889,Samosa Street,Brunswick,"Chinese, Pizza, Desserts, Fast Food",10,3.3
4890,Shanu's Chicken Planet,Dodge City,"Desserts, Tea, Italian, Mexican, BBQ, Fast Food",31,3.2
4891,Shanu's Food Shop,Corpus Christi,"Bakery, Pizza, Cafe, BBQ",10,2.8
4892,Bigbee,Florence,"Desserts, French, Bakery, BBQ, Cafe",79,0.0
4893,Delhi 6 Cafe,Miami,"Pizza, Fast Food, Cafe, Indian, Seafood",29,0.0
4894,Lala Ji Sweets,Reno,"Desserts, Tea, Pizza, Mexican, BBQ",63,0.0
4895,MK's Chinese Food,Missoula,"Desserts, Italian, Mexican, Fast Food, Cafe, Seafood",89,0.0
4896,Nirvana The Divine Kitchen,Great Falls,"Desserts, Mexican, Fast Food, Cafe, Mediterranean, Seafood",90,0.0
4897,Preechen,Key West,"Desserts, Tea, French, BBQ, Fast Food",78,0.0
4898,Rahul Eggs,Portland,"Tea, Fast Food, Desserts, Seafood",57,4.2
4899,7 Stick,Little Rock,"Desserts, Pizza, Italian, BBQ, Cafe",44,2.8
4900,Aashirwad Restaurant,Dubuque,"Bakery, BBQ, Fast Food, American, Seafood",34,2.6
4901,Amar Bakery,Peoria,"Tea, American, BBQ",63,3.3
4902,Apni Rasoi,Midland,"Chinese, Pizza, BBQ, Cafe, Mediterranean",23,3.1
4903,Baked Buns,Birmingham,"Bakery, Pizza, Indian, Mediterranean",37,3.1
4904,Banspi,Akron,"Tea, Cafe, Desserts",40,2.9
4905,Benchmark,Hattiesburg,"Tea, Pizza, BBQ, Cafe, American",34,2.8
4906,Bobby Tikki Wala,Minneapolis,"Bakery, BBQ, Desserts, Seafood",62,3.0
4907,Cafe Coffee Day,Wichita Falls,"Tea, Pizza, BBQ, Seafood",98,2.7
4908,Cafe Coffee Day,Miami,"Desserts, American, BBQ, Seafood",77,2.8
4909,Canteeno,Saipan,"Tea, Desserts, Fast Food",80,3.0
4910,Chai Mantra,New Bern,"Tea, Cafe, Bakery, Desserts",54,3.2
4911,Chandni Chowk ke Mashhoor Makkhan Wale Paranthe,Longview,"Chinese, Pizza, BBQ",66,2.8
4912,Chandni Chowk Parantha Corner,Ogdensburg,"Tea, Mexican, Mediterranean, Seafood",15,3.1
4913,Chauhan Laxmi Sweets,San Juan,"French, Bakery, Cafe, Seafood",63,3.0
4914,Chawla's The Cake Room,Green Bay,"Mexican, Pizza, Desserts, Italian",36,3.4
4915,China Town,Idaho Falls,"Cafe, Mexican, Desserts",34,2.9
4916,Domino's Pizza,Ketchikan,"Tea, BBQ",84,2.6
4917,Faasos,Charlotte Amalie,"Tea, French, BBQ, Mediterranean",58,2.6
4918,Fast Trax,Charleston,"Tea, Mexican, Bakery, BBQ, American, Seafood",81,3.2
4919,Finger Licious,Stockton,"Desserts, Tea, Pizza, Italian, Cafe",50,3.4
4920,Gulshan Pastry Shop,Wichita Falls,"Desserts, Italian, BBQ, Indian, Seafood",49,3.0
4921,Handa's,Miami,"Cafe, Bakery, American, Fast Food",61,2.6
4922,Homely Delight,Appleton,"Desserts, Cafe, Mexican, Bakery, Fast Food, Chinese",34,3.1
4923,Jahangeer Foods,Portsmouth,"Cafe, Mediterranean, Seafood",41,2.7
4924,Kaleva,Harrisburg,"Fast Food, Chinese, Pizza, Italian",73,3.3
4925,Laxmi Vaishno Dhaba,Iron Mountain,"Tea, Seafood, Cafe, Fast Food",35,3.0
4926,Little Pleasure Restaurant & Cafe,Pellston,"Cafe, Pizza, Fast Food, Chinese, Seafood",90,2.9
4927,Mauryan Multi Cuisine Restaurant,Hattiesburg,"Tea, Pizza, French, BBQ, Mediterranean",100,3.4
4928,Mehta Food Junction,Long Beach,"Tea, Italian, Bakery, Fast Food, Indian",93,3.0
4929,Om Bikaner Wale,Kona,"Pizza, BBQ, Seafood",33,2.8
4930,Ovenstory Pizza,Lynchburg,"Tea, Cafe, Indian, Fast Food",91,2.9
4931,Prasadam,Sioux Falls,"Cafe, Bakery, Desserts, Italian",56,2.8
4932,Priyanshi Fast Food,Midland,"Bakery, BBQ, Seafood",20,3.3
4933,Punjabi Tadka,Binghamton,"Pizza, Bakery, Mediterranean, Fast Food",43,3.1
4934,Pyaali,Idaho Falls,"Pizza, Bakery, Fast Food",14,2.8
4935,Ruby Dhaba,Lubbock,"Tea, Bakery, BBQ, Mediterranean, Seafood",98,2.7
4936,Shree Manakamna Fast Food,Los Angeles,"Tea, Bakery, Mediterranean, Desserts",21,3.4
4937,The Chinese Hut,Hagerstown,"Tea, Pizza, BBQ, Mediterranean, Seafood",39,3.0
4938,The Chinese Hut,Austin,"American, Desserts, Fast Food",99,3.2
4939,The Chinese Kitchen,Milwaukee,"Fast Food, Bakery, Mediterranean, Italian",23,3.1
4940,Twenty Four Seven,Presque Isle,"Cafe, Mexican, Indian, Seafood",52,3.1
4941,Vegie Kitchen,Elmira,"Cafe, Mexican, Indian, BBQ",99,3.1
4942,Behrouz Biryani,Charlotte,"Mexican, Bakery, Fast Food, Cafe, American, Seafood",19,3.5
4943,Burger King,Tallahassee,"French, Mexican, Pizza, Bakery",53,3.5
4944,Mohit di Hatti,Durango,"Desserts, Italian, Bakery, Chinese, Seafood",74,3.8
4945,Play Pizza,Valdosta,"Pizza, BBQ",93,3.8
4946,Sushiya Express,Hilo,"Tea, Seafood, Italian",22,3.7
4947,Tantrum Coffee Bar,Akron,"Tea, French, Cafe, Seafood",34,3.5
4948,Chawla's Tandoori Junction,Austin,"Cafe, Pizza, American",82,0.0
4949,Chennai Express Greens,Montgomery,"Tea, Fast Food, Seafood",33,0.0
4950,Omi Pizza,Fort Leonard Wood,"Tea, BBQ, Fast Food, Cafe, Mediterranean",65,0.0
4951,South Indian & Chinese Fast Food,Fort Smith,"French, Mexican, Bakery, Cafe",58,0.0
4952,The Khoj Cafe Restaurent,Walla Walla,"Pizza, Italian, French, Bakery, Fast Food, Seafood",68,0.0
4953,Bharat Chicken Inn,Toledo,"Pizza, BBQ",22,2.4
4954,Nathu's Sweets,Denver,"Tea, Bakery, BBQ, Fast Food",12,2.1
4955,Wah Ji Wah,West Palm Beach,"Tea, Cafe, American, Seafood",40,2.2
4956,QD's Restaurant,New York,"Tea, Desserts, Indian, BBQ",93,4.1
4957,Henri's Bar - Le Meridien,San Angelo,"Tea, Cafe, BBQ, Seafood",70,3.3
4958,Le Belvedere - Le Meridien,Manhattan,"Desserts, Cafe, Chinese, Indian, Seafood",65,3.5
4959,Longitude - Le Meridien,Sarasota,"French, Cafe, Desserts",71,3.9
4960,Nero - Le Meridien,Santa Ana,"Mexican, BBQ, Desserts, Seafood",88,3.5
4961,The One - Le Meridien,San Jose,"Fast Food, Cafe, Bakery, Italian",98,3.8
4962,Eau De Monsoon - Le Meridien,Ogden,"Desserts, Tea, Cafe, French, Fast Food, Chinese",93,4.0
4963,Slounge - Lemon Tree Premier,Helena,"Fast Food, Cafe, Mediterranean, Seafood",14,3.5
4964,Al Bake,Traverse City,"Tea, Bakery, Indian, Mediterranean",77,2.5
4965,Al-Bawarchi,Saipan,"Pizza, Mexican, BBQ, Fast Food, Cafe",83,3.1
4966,Big Dragon,Richmond,"Tea, Chinese, American, Seafood",72,3.1
4967,BTW,Petersburg,"Cafe, Bakery, Fast Food",90,3.3
4968,Capital Curry,New Bern,"Tea, French, Bakery, BBQ, Mediterranean",79,3.1
4969,Domino's Pizza,Scranton,"French, Mexican, Pizza, Fast Food",40,2.5
4970,Ekta's Kitchen,Milwaukee,"French, Pizza, Indian, BBQ",42,3.2
4971,Gopal's,Kona,"BBQ, Bakery, American, Desserts",69,2.9
4972,Moti Mahal Delux,Branson,"Cafe, Pizza, American, Seafood",90,2.6
4973,Open Oven,Concord,"Tea, Bakery, Indian, Desserts",33,3.4
4974,Relax Xpress,Dallas,"Desserts, Pizza, Bakery, Cafe, Mediterranean",53,3.2
4975,Roll Club,Hagerstown,"Chinese, Pizza, Indian, Desserts",30,2.7
4976,SM Gopal Ice Cream & Cakes,Bakersfield,"Pizza, French, Bakery, American, Seafood",57,3.2
4977,Bangla Sweet Corner,Philadelphia,"Cafe, BBQ, Fast Food",14,2.6
4978,Chinois,Corpus Christi,"BBQ, Desserts, Italian",76,3.0
4979,Dawat,Toledo,"Tea, Cafe, Bakery, Pizza",46,2.9
4980,Establishment Ristorante,Santa Barbara,"Tea, Mexican, Bakery, BBQ",60,3.1
4981,Ganesha Sweets & Restaurant,Presque Isle,"Desserts, Mexican, Bakery, Cafe, American, Seafood",52,2.6
4982,Gopala,San Diego,"Pizza, Mexican, BBQ, American, Seafood",98,3.3
4983,Green Chick Chop,Jackson,"Seafood, Pizza, Italian",45,2.9
4984,Hot Chimney,Seattle,"Tea, Pizza, Mexican, Bakery, Fast Food",19,2.5
4985,Icon,Punta Gorda,"Tea, Pizza, BBQ, Cafe, Indian",90,3.2
4986,Juneja's Eating Plaza,Clarksburg,"Tea, Desserts, Seafood",89,3.4
4987,Lodhi Knights,Dallas,"Tea, Pizza, French, Bakery, Cafe",18,3.1
4988,Ram Singh's Bhoj,Salt Lake City,"Tea, Cafe",98,2.9
4989,Republic of Chicken,Killeen,"Bakery, Desserts, Seafood",24,2.7
4990,Slice of Italy,Cedar Rapids,"Seafood, BBQ, Italian",48,3.3
4991,Subway,Nantucket,"Cafe, BBQ, Desserts",34,3.2
4992,The Altitude Cafe and Deli,San Juan,"Tea, BBQ, Fast Food, Chinese, Mediterranean, Seafood",100,3.1
4993,Tokyo Mon Amour,Newburgh,"Tea, Desserts, Italian",36,3.1
4994,Bhane,Long Beach,"Pizza, Mexican, BBQ, Fast Food, Seafood",38,3.6
4995,Celeste,Gainesville,"Pizza, Bakery, Desserts, Fast Food",79,3.5
4996,Chidambaram's New Madras Hotel,Richmond,"Desserts, Pizza, Bakery, BBQ, Chinese",33,3.8
4997,CJ's Fresh,Des Moines,"French, Mexican, Pizza, Seafood",26,3.8
4998,Elma's Brasserie,La Crosse,"French, Indian, Cafe, Fast Food",78,3.7
4999,Kunafa,Johnstown,"BBQ, Pizza, Desserts",68,3.9
5000,Lahori Gate,Branson,"Tea, Bakery, Desserts",53,3.5
5001,M I Food Center,Raleigh,"Pizza, Mediterranean, Fast Food",41,3.8
5002,Sugar Blossoms,Kodiak,"Seafood, Desserts, Fast Food",22,3.6
5003,Eywa by Saby @ Celeste,Pago Pago,"Cafe, American, Fast Food",67,0.0
5004,Cafe Coffee Day,Washington,"Tea, Mexican, Fast Food, Cafe, American, Seafood",53,2.3
5005,Guppy,Roanoke,"Bakery, Mexican, American, Cafe",59,4.1
5006,Ping's Caf愆 Orient,Trenton,"Pizza, BBQ, Fast Food",52,4.1
5007,The All American Diner,Newburgh,"Tea, Pizza, Mexican, Bakery, Seafood",89,4.1
5008,Armaan's Restaurant,San Diego,"Fast Food, Cafe, Seafood, Italian",29,2.8
5009,Garden Chef,El Paso,"Desserts, Mexican, Fast Food, Cafe, Indian",46,3.0
5010,Golooji's Chat Waat,New York,"Pizza, BBQ",53,3.3
5011,Oriental Lee,Harrisburg,"Pizza, Bakery, Desserts",18,2.7
5012,Peshawari Restaurant,Bloomington,"Desserts, Tea, French, Mexican, Seafood",17,3.1
5013,Tikka Town,Plattsburgh,"Tea, Cafe, Desserts, Fast Food",78,3.1
5014,Titu Restaurant,Gunnison,"Pizza, French, Mexican, BBQ, Bakery, Fast Food",44,2.9
5015,Vijay Dhaba,Mason City,"Chinese, Pizza, Fast Food",10,2.9
5016,Wild Willy,Islip,"French, Mexican, Pizza, Desserts",89,3.2
5017,Diva Spiced,San Antonio,"Pizza, Desserts",86,3.7
5018,Granma's Homemade,Texarkana,"Tea, Mexican, Bakery, Cafe, Seafood",57,3.6
5019,Karim's,Decatur,"Cafe, BBQ, Desserts",89,3.8
5020,Sab Ki Khatir,Billings,"Pizza, Fast Food",98,3.7
5021,Golden Bakery,Watertown,"Desserts, Pizza, BBQ, Fast Food, Chinese",15,0.0
5022,Krishan Sweets,Bristol,"Mexican, Bakery, Seafood",88,0.0
5023,Rai Ji Caterers,Columbus,"Cafe, Indian, BBQ",96,0.0
5024,Szoun Chinese Food,Panama City,"Desserts, Tea, French, Bakery, Seafood",76,0.0
5025,Yummy Mummy @ Delhi,Beaumont,"Tea, Pizza, Desserts, Italian",20,0.0
5026,Lodi - The Garden Restaurant,Bemidji,"American, Desserts, Fast Food",71,4.2
5027,Aggarwal Sweets & Restaurant,Key West,"Tea, Chinese, Pizza",13,2.7
5028,Ashirwad Dhaba,Palm Springs,"French, Bakery, Fast Food, Chinese, Seafood",91,2.9
5029,Barichi Restaurant,Plattsburgh,"Tea, Seafood",67,2.9
5030,Bikaner Sweets,Trenton,"Tea, Pizza, Italian, BBQ, Mediterranean",31,2.7
5031,Bikaner,Concord,"Tea, Mexican, BBQ, Fast Food",52,2.9
5032,Chatori Zubaan 2,Green Bay,"Fast Food, Mexican, BBQ, Italian",55,3.0
5033,Chinese Mania,Bakersfield,"French, Bakery, Chinese, Fast Food",31,3.2
5034,Da Pizza Corner,Wichita Falls,"Tea, BBQ, Desserts, Seafood",16,2.5
5035,Dhaba Cash 'N' Carry Kitchen,Traverse City,"BBQ, Mediterranean, Desserts",91,3.1
5036,Dom Dang Kins Restaurant,West Palm Beach,"Cafe, Pizza, BBQ",82,3.1
5037,First Choice,Wichita Falls,"Tea, Mexican, BBQ, Fast Food, Seafood",93,2.9
5038,Hungry Hut,Ogdensburg,"Tea, Chinese, Pizza, Fast Food",21,3.1
5039,Le Seasons Restaurant,Spokane,"Tea, Mexican, Desserts",43,2.8
5040,Moti Mahal Delux,Yakutat,"Cafe, French, Pizza, Chinese",37,3.0
5041,Popsy's,Charleston,"French, BBQ, Desserts, Fast Food",58,3.0
5042,Prabhu,Pago Pago,"Tea, Seafood, BBQ, Italian",92,3.1
5043,Saptagiri,Vernal,"French, Pizza, American, Fast Food",35,2.8
5044,Spice Hut,Orlando,"Chinese, Cafe, Seafood",25,2.9
5045,Taste of Vishal,Atlanta,"Desserts, Tea, American, Bakery, Indian, Seafood",13,2.9
5046,The Tandoori Night,Augusta,"Tea, Italian, BBQ, Cafe, Seafood",30,2.8
5047,Traffic Jaam,Ithaca,"Seafood, Bakery, Cafe, Italian",26,2.9
5048,Tripti,Brunswick,"Cafe, BBQ, Desserts, Fast Food",49,3.1
5049,Uttaranchal Dhaba & Restaurant,Tucson,"French, Bakery, Fast Food",39,2.9
5050,Wah Ji Wah,Lansing,"Tea, Pizza, Bakery, BBQ, Chinese",40,2.9
5051,Resto 37,Binghamton,"Chinese, BBQ, Cafe",31,3.9
5052,Aakash Sweets & Caterers,Eau Claire,"Tea, Pizza, Desserts",38,0.0
5053,Aapka Mangal Restaurant,Dillingham,"Tea, Mediterranean, Fast Food",62,0.0
5054,Al-Karim,Evansville,"Cafe, Pizza, BBQ, Fast Food",75,0.0
5055,Apna Dhaba,Eugene,"BBQ, French, American, Desserts",69,0.0
5056,Burger Wala,Pasco,"Chinese, Pizza, BBQ",26,0.0
5057,Cafe Highway,Sarasota,"Desserts, Seafood",12,0.0
5058,Cake Point,Twin Falls,"French, Pizza, Cafe",100,0.0
5059,Chatori Zubaan Chur Chur Naan,Waco,"Bakery, Pizza, Fast Food",56,0.0
5060,Coffee Shop,Roanoke,"French, Bakery, BBQ, Fast Food",53,0.0
5061,Colonel's Kebabs & Curries,Pellston,"Cafe, BBQ, Seafood",54,0.0
5062,Dhaba Cash 'n' Carry Kitchen Chur Chur Naan,Albuquerque,"Pizza, French, Bakery, Fast Food, Cafe",100,0.0
5063,Dolphin - The Food Cafe,Dillingham,"Desserts, Pizza, Bakery, BBQ, Chinese, Mediterranean",81,0.0
5064,First Treat Bakers,Punta Gorda,"Cafe, Pizza, American, Bakery",36,0.0
5065,Flavours Of Delhi,New Bern,"Cafe, BBQ, Mediterranean, Desserts",30,0.0
5066,Foresto Lawn & Restaurant,Amarillo,"Pizza, Bakery, Mediterranean, Desserts",80,0.0
5067,Jain Sweets & Bakers,Fairbanks,"Pizza, Italian, BBQ, Fast Food, Mediterranean",48,0.0
5068,JD's Restaurant,Islip,"French, Mexican, BBQ, Bakery, Fast Food, Seafood",22,0.0
5069,Just Vada Pav,Dubuque,"BBQ, Fast Food, Cafe, Indian, Seafood",69,0.0
5070,Kaka De Dhaba,Wenatchee,"Cafe, Bakery, Desserts",78,0.0
5071,Kolcata Bengali Dhaba,Dayton,"Cafe, Mediterranean, Seafood",51,0.0
5072,Kukkuu Da Dhaba,Bozeman,"Tea, Bakery, BBQ, Cafe, Indian",58,0.0
5073,M&S Coffee Cafe,Santa Ana,"Desserts, Pizza, Fast Food, Cafe, Indian",53,0.0
5074,Malabar Style Kitchen,Rochester,"Chinese, Pizza, Desserts, Fast Food",34,0.0
5075,Mathura Lassi Wala,Punta Gorda,"Tea, Mediterranean, Fast Food",25,0.0
5076,Metropolitan Cafe,Brownsville,"Tea, Bakery, Mexican, Indian",68,0.0
5077,Mr. Bake,Dillingham,"Tea, Mexican, BBQ, Fast Food, American, Seafood",23,0.0
5078,Mughal-E-Zaika,Lihue,"Cafe, Mexican, BBQ, Seafood",26,0.0
5079,Mukesh Bhojnalaya,Rhinelander,"Fast Food, Cafe, Desserts, Seafood",13,0.0
5080,New Royal Blue Dhaba,Grand Island,"French, Mexican, Bakery, Fast Food, Seafood",35,0.0
5081,New Sharma Chicken Corner,Victoria,"Desserts, BBQ, Bakery, Cafe, Indian",76,0.0
5082,Pakwan,Cedar City,"Desserts, Italian, BBQ, Fast Food, Seafood",53,0.0
5083,Pizza Corner,Duluth,"Pizza, Indian, BBQ, American, Seafood",68,0.0
