,Name,City,Cuisines,Average Cost,Aggregate Rating
7242,Frontier,Vernal,"Pizza, French, Bakery, BBQ, Fast Food",56,3.1
7243,Giani,Moab,"Seafood, Pizza, BBQ, Italian",32,3.3
7244,Hot Pot Snacks,Burbank,"Chinese, Pizza, Seafood",57,3.4
7245,Keventers,Owensboro,"Tea, Mexican, Pizza",34,3.1
7246,Kishan Dhaba,Killeen,"Bakery, Fast Food",74,3.0
7247,Madras Dosa & Chinese,Dillingham,"French, Bakery, BBQ, Mediterranean, Seafood",87,2.7
7248,Mehfil Tawa Tandoor,Amarillo,"Cafe, Indian, Desserts, Seafood",48,3.1
7249,Mitthu Tikki Wala,North Platte,"Tea, Mediterranean, Fast Food",44,3.2
7250,Mitthu Tikki Wala,San Juan,"Tea, Italian, Bakery, Cafe, Mediterranean, Seafood",38,3.4
7251,Pandit Ji Ka Dhaba,Ogden,"Bakery, Fast Food",15,2.9
7252,Punjabi Angeethi,Trenton,"Desserts, Bakery, Fast Food, Chinese, Mediterranean",94,3.2
7253,Ram Chinese Food,Watertown,"Pizza, American, BBQ",46,3.1
7254,Sardar Ji Punjabi Jayeka,Long Beach,"Desserts, Cafe, Pizza, Italian, Bakery, Chinese",66,2.9
7255,SFC,El Paso,"BBQ, Indian, Desserts, Fast Food",23,2.8
7256,SGF - Spice Grill Flame,Akron,"Cafe, Pizza, Mediterranean, Fast Food",21,3.1
7257,Shalimar Vyanjan,Cincinnati,"Cafe, BBQ, Seafood, Fast Food",45,3.0
7258,Shri Rudram,Atlanta,"Tea, Chinese, Cafe, Desserts",35,3.1
7259,Smile Bakers,Great Falls,"Desserts, Pizza, Italian, Cafe, Seafood",55,3.1
7260,Spice Sea,Devils Lake,"Pizza, Mexican, BBQ, Fast Food, Seafood",18,3.3
7261,Street 5,Evansville,"BBQ, Desserts, Seafood",16,2.8
7262,Subs n Shakes,Dallas,"French, Bakery, Mediterranean, Seafood",74,3.1
7263,Subway,Longview,"American, Desserts, Seafood",22,2.6
7264,Twenty Four Seven,Bloomington,"Fast Food, Bakery, Desserts, Seafood",74,3.3
7265,Wah G Wah,Wenatchee,"Tea, Seafood, Italian",55,2.6
7266,Aman-Deep Pure Veg,Branson,"Bakery, Desserts, Fast Food",25,3.5
7267,Kwality Pastry Parlour,San Antonio,"Pizza, Seafood",74,3.5
7268,McDonald's,Charleston,"Mexican, BBQ, Desserts",55,3.5
7269,Nagpal's,Charleston,"Desserts, Cafe, Pizza, Bakery, Chinese",10,3.5
7270,Peshawari's Deluxe,Bangor,"Cafe, Mexican, Pizza, Italian",41,3.7
7271,Slic Chic,Kahului,"Cafe, Pizza, Seafood",69,3.8
7272,Standard Ice Cream,Jackson,"Chinese, Pizza, American, Cafe",63,3.5
7273,Aunty Chings Fast Food,Marquette,"Pizza, Bakery, Cafe, American, Seafood",42,0.0
7274,Baba Chaap Wala,Corpus Christi,"Cafe, Pizza, Bakery, Chinese, Indian",51,0.0
7275,Cafe Coffee Day,Honolulu,"Tea, Mexican, Fast Food, Mediterranean, Seafood",86,0.0
7276,Chick N Grills,Petersburg,"Fast Food, Cafe, Pizza, Italian",63,0.0
7277,Choc-oholic,Moab,"Chinese, Pizza, Fast Food, Cafe, Mediterranean, Seafood",33,0.0
7278,Da Pizza Palace,Peoria,"French, BBQ, Cafe, Fast Food",92,0.0
7279,Dosa Junction,Jacksonville,"Tea, Italian, French, BBQ, Fast Food, Cafe",21,0.0
7280,Ganga Food Factory,Roswell,"Tea, Mexican, Desserts, Fast Food",89,0.0
7281,Hot Wok,Champaign,"Fast Food, Pizza, Desserts, Seafood",74,0.0
7282,Ichak Dana,Mosinee,"Tea, Cafe, Bakery, Fast Food",67,0.0
7283,Madras Dosa & Chinese,St. Petersburg,"Pizza, Indian, BBQ, Italian",15,0.0
7284,Mashoor Gulati,San Jose,"Bakery, Desserts, Seafood",68,0.0
7285,Nidhi's Cake Lounge,Detroit,"Desserts, Pizza, Bakery, BBQ, Mediterranean",73,0.0
7286,Night Diner,Manchester,"Cafe, Mexican, Bakery, Pizza",87,0.0
7287,Nirula's Ice Cream,Deadhorse,"Pizza, Italian, BBQ, Fast Food, Seafood",47,0.0
7288,Niti Shake & Ice Cream Hub,Los Angeles,"Tea, Cafe, Mexican, Mediterranean",32,0.0
7289,Raja Chinese Foods & Snacks,North Platte,"Pizza, BBQ, Italian",65,0.0
7290,Royal Chicken Corner,Everett,"Seafood, Pizza, Italian",44,0.0
7291,Shalimar Food,Bozeman,"Cafe, Indian, BBQ",81,0.0
7292,Shalimar Vyanjan,Jackson,"Tea, Bakery, Desserts, Fast Food",29,0.0
7293,The Urban Canteen,Santa Maria,"Cafe, Mexican, Pizza, Seafood",37,0.0
7294,Ever Bake,Indianapolis,"Chinese, Pizza, Desserts",47,4.0
7295,Grappa - Shangri-La's - Eros Hotel,Rockford,"Bakery, Desserts, Italian",21,3.4
7296,Shang Palace - Shangri-La's Eros Hotel,San Luis Obispo,"Tea, Mexican, BBQ, Fast Food, Indian",33,3.7
7297,Sorrento - Shangri-La's - Eros Hotel,Williston,"Tea, Cafe, Pizza, Desserts",99,3.9
7298,Mister Chai - Shangri-La's - Eros Hotel,Santa Barbara,"Cafe, Indian, Desserts, Seafood",87,4.1
7299,Tamra - Shangri-La's - Eros Hotel,Iron Mountain,"Tea, Cafe, Pizza",25,4.3
7300,Cafe Coffee Day,Charleston,"Cafe, BBQ, Desserts, Seafood",60,3.4
7301,Domino's Pizza,Sun Valley,"Tea, French, Bakery, Cafe",99,2.8
7302,Lush,Devils Lake,"Cafe, Seafood",23,0.0
7303,Shivas Cafe,Midland,"Bakery, Mexican, Pizza",50,3.1
7304,Dakshin - Sheraton New Delhi Hotel,Nashville,"Cafe, Pizza, Indian, Bakery",63,4.0
7305,Delhi Pavilion - Sheraton New Delhi Hotel,Bemidji,"Tea, Chinese, Pizza, Fast Food",70,4.0
7306,Pan Asian - Sheraton New Delhi Hotel,White Plains,"Mexican, Bakery, Mediterranean, Desserts",72,4.2
7307,Domino's Pizza,Medford,"Chinese, BBQ, Desserts",47,2.5
7308,Kitchen of Awadh,Fort Myers,"Desserts, Italian, Cafe, Mediterranean, Seafood",88,3.4
7309,McDonald's,Charleston,"Chinese, Cafe, Desserts",15,3.3
7310,ODT,West Palm Beach,"Tea, Cafe, Bakery",58,3.3
7311,Rainbows,Huntsville,"Bakery, BBQ, Seafood",11,2.6
7312,Subway,Midland,"Tea, Mediterranean, Desserts, Seafood",89,3.4
7313,Bombay Bhelpuri,Indianapolis,"Tea, Pizza, BBQ, Fast Food, Indian",92,3.9
7314,The Owl's Kitchen,Punta Gorda,"Tea, Mexican, Seafood",28,3.5
7315,7 Colours Xpress Kitchen,Memphis,"Chinese, Bakery, Mediterranean, BBQ",33,0.0
7316,Royal Cakes,Helena,"Tea, Fast Food, Cafe, American, Seafood",37,0.0
7317,Street Cafe,Cincinnati,"Cafe, Mexican, Desserts",71,0.0
7318,Street Cafe,Provo,"Tea, Seafood, Cafe, Fast Food",11,0.0
7319,Dare To Deliver,Fayetteville,"Chinese, Desserts, Seafood",88,2.3
7320,Aggarwal Sweet and Restaurant,San Francisco,"Desserts, Mexican, BBQ, Fast Food, Cafe",17,2.9
7321,Burger Lust,Cape Girardeau,"Desserts, French, BBQ, Cafe, Seafood",63,2.9
7322,Cafe Coffee Day,Amarillo,"Tea, Bakery, American",15,3.4
7323,Cakes & Bakes,Bozeman,"Seafood, BBQ, Fast Food",71,3.2
7324,Chic Fillet,La Crosse,"Bakery, Pizza, BBQ, Seafood",52,2.9
7325,Chinese Express,Panama City,"Pizza, Fast Food, Cafe, Mediterranean, Seafood",14,3.1
7326,Costa Coffee,Martha's Vineyard,"Desserts, Tea, Pizza, Bakery, Chinese",61,3.1
7327,Domino's Pizza,Ogdensburg,"Mexican, Bakery, BBQ, Fast Food, Seafood",74,2.9
7328,Gupta Fast Food,Eugene,"French, Pizza, Indian, Bakery",34,3.4
7329,Hangchuaa's Chinese Food Corner,Yakima,"Fast Food, BBQ, Italian",37,3.1
7330,Kathi's,Long Beach,"Tea, BBQ, Fast Food, Cafe, Indian, Mediterranean",88,3.0
7331,Kitchen & Chicken,Bellingham,"Tea, Cafe, Desserts, Fast Food",28,3.2
7332,Meal A Deal,Helena,"American, BBQ, Fast Food",36,2.8
7333,Mohit Restaurant,Eugene,"Tea, Bakery, BBQ, Seafood",31,2.8
7334,Princess Garden,Corpus Christi,"Desserts, Tea, BBQ, Fast Food, Chinese",15,2.7
7335,Republic of Chicken,St. Cloud,"Tea, Chinese, Seafood, Fast Food",98,2.8
7336,Sai Juice Point,Baltimore,"BBQ, Desserts",90,3.1
7337,The Pirates Of China Town,Baltimore,"Chinese, Cafe, Desserts",31,3.2
7338,Voda Bar,South Bend,"Tea, Fast Food, BBQ, Seafood",95,3.2
7339,All Things Yummy,Ontario,"Cafe, Bakery, Italian",20,3.8
7340,Cake Palace,Kodiak,"Desserts, Pizza, Italian, Mexican, Bakery, BBQ",90,3.8
7341,Charan Singh Kulfi & Kala Khatta,Nantucket,"Desserts, Tea, Cafe, American, Seafood",65,3.6
7342,Chinese Hut,San Luis Obispo,"Desserts, Italian, BBQ, Fast Food, Cafe, American",89,3.6
7343,Costa Coffee,Scottsbluff,"Tea, Bakery, Italian",79,3.8
7344,Daitchi,West Yellowstone,"Tea, Mexican, Pizza, Desserts",40,3.5
7345,DomDom Biryani,Fresno,"Pizza, BBQ, Desserts",23,3.7
7346,Gupta's Restaurant,Oakland,"Tea, Bakery, American, Mediterranean",32,3.5
7347,Mama's,Bloomington,"Tea, Pizza, French, BBQ, Cafe, Mediterranean",73,3.5
7348,McDonald's,Iron Mountain,"Desserts, BBQ, Bakery, Cafe, American",20,3.6
7349,Moti Mahal Delux- Legendary Culinary,Bismarck,"Pizza, BBQ",80,3.6
7350,Qureshi's Kabab Corner,Beaumont,"Tea, Chinese, Desserts",77,3.6
7351,TukTuk,Hilo,"Desserts, Italian, Bakery, Mediterranean, Seafood",60,3.8
7352,Anand Sweets,Knoxville,"Fast Food, Pizza, Indian, Seafood",45,0.0
7353,Cafe Corner,Helena,"French, Cafe, Desserts, Seafood",65,0.0
7354,Chocolics,Mosinee,"Bakery, American, BBQ",81,0.0
7355,ChocoLite,Valdosta,"Desserts, Pizza, Mexican, Fast Food, Cafe, Indian",23,0.0
7356,F Marquee,Cincinnati,"Tea, Cafe, Desserts, Fast Food",91,0.0
7357,Republic of Chicken,Valdosta,"Mexican, Bakery, Seafood",12,0.0
7358,Special Chicken Biryani,Kotzebue,"Cafe, Bakery, Desserts, Italian",72,0.0
7359,Circus,Fayetteville,"Seafood, BBQ, Desserts, Italian",40,4.0
7360,The Society Cafe,Sarasota,"Fast Food, French, Seafood, Italian",29,4.1
7361,Club London,Muskegon,"Tea, Chinese, Bakery, Fast Food",63,3.3
7362,3 Pegs Down,Dubuque,"Chinese, Pizza, Cafe, Fast Food",80,3.6
7363,Chicago Pizza,Brunswick,"Cafe, Bakery, Fast Food",46,2.6
7364,Maakhansingh,San Angelo,"Tea, Bakery, Indian, Desserts",53,2.9
7365,Mad Over Donuts,Salt Lake City,"Desserts, Seafood",32,3.8
7366,Starbucks,Charlotte Amalie,"French, Pizza, Fast Food",21,3.7
7367,World of Wok,Milwaukee,"Italian, Fast Food, Cafe, Mediterranean, Seafood",74,3.6
7368,Alvi's Food Spot,Tampa,"Desserts, Mexican, American, BBQ",22,3.2
7369,Cafe Coffee Day,St. Louis,"Desserts, Tea, Cafe, Mexican, Chinese",29,2.7
7370,Code,Pensacola,"French, Bakery, Indian, Fast Food",29,2.5
7371,Haowin,Yakima,"Fast Food, French, Indian, Seafood",12,3.2
7372,Mirror,Kahului,"Tea, BBQ, Pizza, Desserts",91,3.3
7373,Pizza Hut Delivery,Philadelphia,"Cafe, Desserts, Bakery, BBQ",76,2.7
7374,Platinum Lounge,Lubbock,"Tea, French, BBQ, Fast Food, Seafood",86,3.3
7375,Aap Ki Rasoi Ghar,Pasco,"Desserts, Tea, Mexican, BBQ, Fast Food",27,3.0
7376,Aggarwal Sweet & Pastry,Raleigh,"Tea, Bakery, BBQ, Mediterranean",95,2.8
7377,Craving,Plattsburgh,"Desserts, Pizza, Italian, Bakery, Fast Food",42,3.1
7378,Dakshin South Indian Hut,Christiansted,"Bakery, BBQ",95,3.0
7379,Food & Travel Cafe,Saipan,"Desserts, BBQ, Bakery, Cafe, Indian",48,3.2
7380,Jolly Tandoori Zaika,Atlantic City,"Mexican, Indian, BBQ, Pizza",76,3.2
7381,Lababdar Rasoi,Beaumont,"Pizza, American, Indian, Desserts",35,3.3
7382,Madan Da Dhaba,Watertown,"Pizza, Italian, Bakery, BBQ, American, Seafood",55,3.0
7383,Nishtha,Portsmouth,"Cafe, Mexican, Bakery, Fast Food",52,3.3
7384,P2 Tandoori Momos Station,Wilmington,"Bakery, Indian, Seafood",64,3.1
7385,Punjabi's Veg Grill,Yuma,"American, Desserts, Seafood",44,2.9
7386,Sethi's The Cake Shop,Twin Falls,"Tea, Bakery, BBQ, Seafood",78,2.8
7387,Soya Grill,Dallas,"Cafe, Pizza, BBQ, Fast Food",84,3.0
7388,Sunny Kebab Wala,Beaumont,"Chinese, Pizza, Bakery, Fast Food",73,3.3
7389,Vaishno Bhojnalaya,Belleville,"French, Bakery, Desserts",77,3.1
7390,Valentine Coffee Bar,Killeen,"Tea, Bakery, BBQ, Chinese, American, Seafood",20,2.9
7391,Zayka Delhi-6,Anchorage,"Bakery, Indian, Mediterranean, Seafood",99,3.1
7392,13 Cafe,Sacramento,"Tea, BBQ, Mediterranean, Desserts",59,0.0
7393,Aggarwal Sweet Corner,Sun Valley,"Cafe, Bakery, Chinese, Indian, Seafood",78,0.0
7394,Babu Meat Wala,Lynchburg,"Desserts, Pizza, Mexican, Fast Food, American, Seafood",78,0.0
7395,Batra Chinese Food & Chaap,Laredo,"Bakery, Mexican, Indian, Desserts",100,0.0
7396,Celebration Family Restaurant,Martha's Vineyard,"Cafe, Mexican, Fast Food",53,0.0
7397,Ching Chinese,Spokane,"Pizza, Italian, French, Bakery, Fast Food, Cafe",82,0.0
7398,Choices An Absolute BBQ,Cedar City,"Desserts, Tea, Mexican, Mediterranean, Seafood",91,0.0
7399,Delhi-27,Tulsa,"Pizza, Bakery, Cafe, Mediterranean, Seafood",67,0.0
7400,Desi Kukkad,Seattle,"Bakery, American, BBQ",71,0.0
7401,Freezy,Grand Island,"Desserts, Tea, Pizza, Cafe, Indian",31,0.0
7402,Gourmet Bistro,Staunton,"Tea, French, Cafe",65,0.0
7403,Jiya Amritsari Naan,Alexandria,"Cafe, Bakery",43,0.0
7404,Kedgy Bite,Erie,"Desserts, Tea, Pizza, French, Seafood",49,0.0
7405,Khera's Foodie Corner,Scottsbluff,"Tea, Pizza",18,0.0
7406,Lajwab Pastry Palace,Saipan,"Desserts, Bakery, BBQ, Italian",63,0.0
7407,Madan Sweets & Bakers,Punta Gorda,"French, Seafood, Desserts, Fast Food",49,0.0
7408,Momo's King,Lewiston,"Tea, Cafe, Pizza, Bakery, Chinese",30,0.0
7409,New Pishori Chicken Kabab,Tampa,"Tea, Bakery, BBQ, Mediterranean",74,0.0
7410,New Sindhi Chicken Corner,Valparaiso,"Tea, Mexican, BBQ, Cafe, Mediterranean",17,0.0
7411,Radha Swami Chaat Bhandar,Arcata,"Pizza, Mediterranean, Seafood",87,0.0
7412,Rajender Di Punjabi Rasoi,Las Vegas,"Chinese, Bakery, Desserts, Fast Food",94,0.0
7413,Ram Ji Snacks & Food Corner,Walla Walla,"Desserts, Fast Food",27,0.0
7414,Ram Ram Ji Kachori Bhandar,Milwaukee,"Chinese, Desserts, American, BBQ",44,0.0
7415,Rana's Food Corner,Manhattan,"Fast Food, American, Seafood",52,0.0
7416,Sanjay Chicken Shop,Indianapolis,"Italian, French, BBQ, Fast Food, Cafe",49,0.0
7417,Sharma Ji Spring Roll,Shreveport,"BBQ, Mediterranean, Seafood",78,0.0
7418,Shree Raja Ram,Peoria,"Desserts, Tea, Pizza, Indian, Seafood",27,0.0
7419,South Indian Hut,Hyannis,"Cafe, American, Seafood",31,0.0
7420,Special Moradabadi Chicken Corner,Beaumont,"Italian, Bakery, BBQ, Fast Food, Indian",51,0.0
7421,Standard Pastry Shop,Cape Girardeau,"Desserts, Pizza, Bakery, BBQ, American, Mediterranean",29,0.0
7422,Sushil Punjabi Vaishno Dhaba,North Platte,"Desserts, French, BBQ, Cafe, Seafood",67,0.0
7423,Variety of Shawarmas,Portsmouth,"Tea, Italian, Bakery, BBQ, Fast Food",29,0.0
7424,Vrindavan Sweets,Texarkana,"Cafe, Bakery, American",80,0.0
7425,Flirty Momo's,Hilo,"Tea, Cafe, Pizza, BBQ",67,2.4
7426,Nathu's Sweets,Moline,"French, Bakery, BBQ, Cafe",50,3.3
7427,Basil & Thyme,Gunnison,"Desserts, Tea, Pizza, BBQ, Chinese",22,3.6
7428,Kamal's,Gulfport,"Cafe, BBQ, Seafood",34,3.7
7429,Orange Peel by Rasleen Kochhar,Medford,"Pizza, Mexican, BBQ, Mediterranean, Seafood",49,3.6
7430,ATM Bistro,San Luis Obispo,"Tea, Bakery, Pizza, American",84,0.0
7431,Masala House,Bismarck,"Tea, Italian, Bakery, Fast Food, Cafe, Indian",72,4.0
7432,Number 8,Manchester,"Cafe, BBQ, Seafood",43,4.0
7433,Keventers,Lawton,"Tea, Cafe, Mediterranean",47,3.2
7434,4700BC Popcorn,Portland,"Tea, Mexican, Fast Food, Cafe, Seafood",54,3.2
7435,Chennai X-Press,Chicago,"Cafe, BBQ",72,2.9
7436,Chinese Sigdi,Boston,"Tea, French, Cafe, Fast Food",58,3.0
7437,Da Pizza Pind,Plattsburgh,"Seafood, Bakery, Cafe, Fast Food",75,3.2
7438,Faasos,St. Cloud,"Mexican, Pizza, Mediterranean, Fast Food",74,3.0
7439,Frontier,Austin,"Fast Food, Cafe, Bakery, Seafood",23,2.9
7440,Gyan Di Hatti,Akron,"Tea, Pizza, Bakery, BBQ",98,2.9
7441,Hot Stuff,Beaumont,"Cafe, Pizza, American, Desserts",90,3.3
7442,KK Da Dhaba,Charleston,"Seafood, Mexican, Desserts, Fast Food",35,3.4
7443,Last Bencher's,Portland,"French, Bakery, Fast Food, Cafe, Seafood",94,3.0
7444,Raj Bakers And Confectioners,Scottsbluff,"Chinese, Seafood, Desserts, Fast Food",40,3.0
7445,Taste Drive,Provo,"Bakery, Pizza, Indian, Cafe",46,3.4
7446,The Kafilla,Martha's Vineyard,"Pizza, Mexican, Bakery, Fast Food, Cafe, Mediterranean",17,3.0
7447,Tibb's Frankie,Little Rock,"Cafe, Pizza",63,3.1
7448,4 Barrels Caf愆 & Lounge,Victoria,"Indian, BBQ, Seafood",89,3.5
7449,Baadshah,San Juan,"Desserts, Pizza, Fast Food, Chinese, Indian",85,3.5
7450,Behrouz Biryani,Harrisburg,"Desserts, BBQ, Fast Food, Mediterranean, Seafood",75,3.5
7451,Galina Restaurant,Beaumont,"Cafe, Pizza, Desserts, Fast Food",99,3.5
7452,Masala Factory,Moab,"French, BBQ, Fast Food, Cafe, American",22,3.8
7453,Ovenstory Pizza,Deadhorse,"Italian, Fast Food, Cafe, American, Seafood",31,3.5
7454,Ajeet Fast Food Corner,Belleville,"Tea, Bakery, Fast Food, American, Mediterranean, Seafood",91,0.0
7455,Al Changezi,Baton Rouge,"Bakery, American, Fast Food",47,0.0
7456,Dolce Gelato,Greensboro,"Cafe, Mexican, Seafood, Italian",44,0.0
7457,Dragon Way,San Diego,"Desserts, Mexican, Cafe, American, Seafood",77,0.0
7458,Foodaholic,Fresno,"Tea, Cafe, Mexican, Bakery, Chinese, Seafood",39,0.0
7459,Indian Chinese Fast Food,Kahului,"Tea, Seafood",90,0.0
7460,Jagadeesh Kharodewala,Harrisburg,"Cafe, Pizza, Indian, Desserts",18,0.0
7461,Punjabi Shahi Chicken Soup,Albuquerque,"Chinese, Cafe, Seafood",28,0.0
7462,Ramu Ka Dhaba,Tucson,"Tea, Mexican, BBQ, Fast Food, Cafe",90,0.0
7463,Sardar Ji Chicken Corner,Omaha,"Tea, Bakery, BBQ, Seafood",37,0.0
7464,Satguru Tiffin Service,Pensacola,"American, BBQ, Seafood",50,0.0
7465,Seth Baker's,Rochester,"Chinese, Desserts, Pizza, French, BBQ, Cafe",58,0.0
7466,Sri Durga Dosa Corner,Jackson,"Cafe, Mexican, Seafood",14,0.0
7467,V S Cafe,Savannah,"Desserts, Tea, Pizza, Italian, Bakery, Chinese",97,0.0
7468,Vijay South Indian Food,Fort Leonard Wood,"Pizza, Desserts, Fast Food",38,0.0
7469,Punjab Grill,Nantucket,"Tea, Mexican, Indian, BBQ",83,4.3
7470,Insomnia - Taj Vivanta,Ontario,"Desserts, Italian, Bakery, BBQ, Fast Food",44,3.3
7471,Larry's China - Taj Vivanta,Gunnison,"Cafe, Bakery, Indian, Italian",33,3.7
7472,Yellow Brick Road - Taj Vivanta,Roanoke,"Cafe, Pizza, Italian, Bakery, Chinese",75,3.9
7473,English Tadka,North Bend,"Pizza, Seafood",32,3.3
7474,Burger King,Eau Claire,"Tea, Pizza, French, BBQ, Cafe",80,3.6
7475,Pizza Hut,Dayton,"Desserts, Cafe, Mexican, Bakery, Chinese, Seafood",76,3.6
7476,Cake Shop - The Ashok,Green Bay,"Tea, Pizza, Desserts",78,3.1
7477,Samavar - The Ashok,Portland,"Tea, Bakery, Indian, Seafood",76,3.2
7478,Tea Lounge - The Ashok,Staunton,"Pizza, French, Fast Food, Cafe, Seafood",81,3.2
7479,Frontier - The Ashok,Gulfport,"Tea, Chinese, BBQ",71,3.7
7480,The Oudh - The Ashok,Decatur,"BBQ, Seafood",45,3.6
7481,Zerruco - The Ashok,Boise,"Italian, Bakery, Fast Food, Cafe, Indian",15,4.4
7482,The Claridges Garden -The Claridges,Durango,"Tea, Pizza, Mexican, Mediterranean, Seafood",94,3.1
7483,Aura - The Claridges,Rochester,"Desserts, Cafe, Bakery, Chinese, Seafood",77,3.5
7484,Dhaba - The Claridges,West Yellowstone,"Pizza, Mediterranean, Seafood",70,3.9
7485,Jade - The Claridges,Fresno,"Tea, BBQ, Seafood",81,3.8
7486,Pickwicks - The Claridges,Cheyenne,"Cafe, American, Fast Food",31,3.7
7487,Ye Old Bakery - The Claridges,Bellingham,"Desserts, Tea, BBQ, Cafe, Indian",84,3.7
7488,Sevilla - The Claridges,Dillingham,"Tea, French, Bakery",75,4.3
7489,GBar - The Grand New Delhi,Myrtle Beach,"Desserts, Italian, Cafe, Indian, Seafood",88,3.3
7490,Cascades - The Grand New Delhi,Charleston,"Bakery, BBQ",62,3.6
7491,1911 Bar - The Imperial,Nashville,"Desserts, Pizza, Italian, American, Seafood",76,3.2
7492,Nostalgia at 1911 Brasserie - The Imperial,Escanaba,"Tea, Fast Food",58,3.2
7493,Patiala Peg - The Imperial,Cincinnati,"Chinese, BBQ, Mediterranean, Desserts",40,3.3
7494,1911 - The Imperial,Lake Charles,"Tea, French, Seafood, Fast Food",53,3.9
7495,Daniell's Tavern - The Imperial,Greenville,"Desserts, BBQ, Fast Food, Cafe, Mediterranean",61,3.7
7496,La Baguette - The Imperial,Fort Dodge,"Chinese, Bakery, Mediterranean, BBQ",20,3.8
7497,San Gimignano - The Imperial,Richmond,"Tea, Pizza, American, Seafood",78,3.7
7498,The Atrium - The Imperial,Yakutat,"Seafood, Cafe, Italian",32,3.6
7499,The Spice Route - The Imperial,Key West,"Chinese, Pizza, BBQ",36,4.0
7500,Bao Cha,Kalispell,"Tea, Bakery, Italian",24,3.0
7501,Nazeer Delicacies,Indianapolis,"Tea, Bakery, Pizza, Cafe",25,3.3
7502,Open Oven,Bakersfield,"Fast Food, BBQ, Italian",84,3.4
7503,Slurp Pasta Express,Alexandria,"Tea, Pizza, BBQ, Fast Food",100,2.9
7504,Urban Gala,Duluth,"Cafe, Mexican, Mediterranean, Seafood",63,2.8
7505,Shree Rathnam,Aguadilla,"Pizza, American, BBQ, Italian",89,3.5
7506,Stuffed Kathi Roll,Daytona Beach,"Desserts, Mexican, Bakery, Fast Food, Chinese",67,0.0
7507,Subway,Philadelphia,"Tea, Cafe, Pizza, Fast Food",96,1.9
7508,24/7 Pastry Shop - The Lalit New Delhi,Kotzebue,"Tea, Cafe, Mediterranean, Fast Food",19,3.3
7509,Le Petit Cafe - The Lalit New Delhi,Islip,"French, Bakery, Fast Food",84,3.2
7510,The Grill Room - The Lalit New Delhi,Aguadilla,"Desserts, Mexican, BBQ, Cafe, Mediterranean",27,3.4
7511,24/7 Bar- The Lalit New Delhi,Evansville,"Desserts, Italian, French, Bakery, BBQ, Seafood",28,3.5
7512,24/7 Restaurant - The Lalit New Delhi,Salt Lake City,"Cafe, Mexican, BBQ, Desserts",30,3.7
7513,Baluchi - The Lalit New Delhi,Ithaca,"Cafe, Pizza, Italian, BBQ, Fast Food, Chinese",77,3.9
7514,Kitty Su - The Lalit New Delhi,Devils Lake,"Tea, French, Fast Food",73,3.7
7515,Woks - The Lalit New Delhi,West Yellowstone,"Cafe, Chinese, Pizza, Mediterranean",27,3.6
7516,Caf愆 Knosh - The Leela Ambience Convention Hotel,Portsmouth,"Desserts, Tea, BBQ, Bakery, Chinese, Indian",67,3.9
7517,Cherry Bar - The Leela Ambience Convention Hotel,Madison,"Tea, BBQ, Cafe, Indian, Seafood",28,3.6
7518,Mei Kun - The Leela Ambience Convention Hotel,Alexandria,"French, Bakery, American, BBQ",95,3.6
7519,Dilli 32 - The Leela Ambience Convention Hotel,Bend,"Desserts, Tea, Pizza, BBQ, Chinese, Indian",40,4.0
7520,Jamavar - The Leela Palace,Boston,"Cafe, Pizza",38,3.9
7521,Le Cirque - The Leela Palace,Decatur,"Fast Food, Bakery, Pizza, Seafood",30,3.8
7522,MEGU - The Leela Palace,Norfolk,"Tea, Pizza, Italian, French, Fast Food",100,3.9
7523,The Library - The Leela Palace,Fort Myers,"Bakery, Pizza, American, Seafood",24,3.7
7524,The Lobby Lounge - The Leela Palace,Bismarck,"Pizza, Mexican, Fast Food, American, Seafood",24,3.6
7525,The Lodhi Bakery - The Lodhi,Plattsburgh,"Desserts, Pizza, Fast Food, Cafe, Indian",90,2.9
7526,Elan - The Lodhi,Los Angeles,"Seafood, Desserts, Italian",61,3.8
7527,Agni - The Park,Las Vegas,"Mexican, BBQ, Desserts",61,3.3
7528,Mist - The Park,Valdosta,"Desserts, Pizza, BBQ, Mediterranean, Seafood",37,3.3
7529,Aqua - The Park,Provo,"Fast Food, Mexican, BBQ, Pizza",56,3.8
7530,Atrium Bar  & Lounge - The Suryaa New Delhi,Fayetteville,"Cafe, Pizza, Italian",45,3.1
7531,French Crust - The Suryaa New Delhi,Midland,"Desserts, Pizza, Mexican, Bakery, Fast Food",81,3.3
7532,Club BW - The Suryaa New Delhi,North Bend,"Chinese, Mexican, Bakery, Desserts",68,3.6
7533,Sampan - The Suryaa New Delhi,Portsmouth,"Desserts, Pizza, French, Mexican, Bakery",17,3.7
7534,The Grill Room - The Taj Mahal Hotel,Mason City,"Tea, BBQ",63,3.1
7535,Emperor's Lounge - The Taj Mahal Hotel,Alamosa,"Tea, Italian, BBQ, Cafe, Seafood",65,3.8
7536,Machan - The Taj Mahal Hotel,Marquette,"Bakery, BBQ, Desserts, Fast Food",84,3.9
7537,Ricks Bar - The Taj Mahal Hotel,Petersburg,"Tea, Bakery, Fast Food, Cafe, Mediterranean",29,3.6
7538,Wasabi by Morimoto - The Taj Mahal Hotel,Pocatello,"Tea, Pizza, Mexican, BBQ, Cafe, Indian",36,3.9
7539,House of Ming - The Taj Mahal Hotel,Devils Lake,"Tea, Desserts, Fast Food",33,4.0
7540,Varq - The Taj Mahal Hotel,Ontario,"Cafe, Pizza, Fast Food",81,4.2
7541,Capital Kitchen - Taj Palace Hotel,Lewiston,"Cafe, Pizza, Fast Food",35,3.7
7542,Spicy Duck - Taj Palace Hotel,Kona,"Italian, Bakery, BBQ, Fast Food, Chinese",85,3.5
7543,Orient Express - Taj Palace Hotel,Fort Myers,"French, Pizza, Bakery, Cafe",48,4.0
7544,The Tea Lounge - Taj Palace Hotel,Ontario,"Desserts, BBQ, Cafe, Indian, Seafood",24,4.0
7545,Bonitos - The Uppal,Sault Ste. Marie,"Tea, Cafe, BBQ, Seafood",94,3.2
7546,Bonitos Blu - The Uppal,Yakima,"Chinese, Bakery, Desserts, Fast Food",47,3.0
7547,The Gourmet Shop - The Uppal,Birmingham,"Desserts, Tea, Mexican, Fast Food, American",52,3.0
7548,Chopsticks,Buffalo,"Cafe, Seafood, Italian",14,3.6
7549,TabulaBeach Cafe,Ogdensburg,"Pizza, Mexican, Fast Food, Cafe, Indian",67,3.8
7550,Arriba - Mexican Grill & Tequileria,Atlanta,"Tea, Fast Food",99,4.1
7551,Chatori Gali,Portland,"Desserts, Pizza, Italian, BBQ, Fast Food",40,0.0
7552,Aggarwal Sweet Center,Kahului,"Chinese, Pizza, Mediterranean, Desserts",94,2.9
7553,Aggarwal Sweets,Binghamton,"Pizza, Mediterranean, Desserts, Seafood",29,2.7
7554,Alag Khana Khazana,Harrisburg,"Chinese, Desserts, Seafood",61,2.9
7555,Bhape Di Hatti,Toledo,"Tea, BBQ, Fast Food, Cafe, Mediterranean",42,3.1
7556,Bhappe Di Hatti,Santa Maria,"Tea, BBQ, Mediterranean",50,3.1
7557,Bhatura King,Kodiak,"Tea, BBQ, Desserts, Fast Food",80,2.9
7558,Bhukkadzz Point,Hagerstown,"French, Pizza, Mediterranean, Seafood",31,3.0
7559,Bimbos,Atlanta,"Pizza, Italian, BBQ, Fast Food, Seafood",13,3.1
7560,Brothers' Bakery,Billings,"Italian, Bakery, Fast Food, Cafe, Mediterranean",45,2.9
7561,Chaap Nation,Elmira,"Desserts, Tea, Cafe, Bakery, Chinese",48,3.0
7562,Dev Burger,Newark,"Tea, Italian, Bakery, Fast Food, Cafe",31,2.9
7563,Green Chick Chop,Baltimore,"Pizza, Mexican, Bakery, Mediterranean, Seafood",15,3.0
7564,Green Chick Chop,Victoria,"Tea, BBQ, Pizza, Desserts",69,3.2
7565,Hum Sabki Rasoi,San Diego,"Pizza, BBQ, Fast Food, American, Seafood",63,3.3
7566,Janki Vaishno Dhaba,Des Moines,"Fast Food, BBQ, Desserts, Seafood",69,3.0
7567,Manmohan Food Plaza,Santa Ana,"Tea, BBQ, Fast Food",24,2.6
7568,Mr.Hunger,Durango,"Chinese, BBQ, Desserts, Fast Food",81,3.0
7569,Neelma Punjabi Dhaba,Pocatello,"Mexican, Bakery, Desserts",10,2.9
7570,New Raj Kachori Bhandar,Savannah,"Tea, Seafood",12,3.4
7571,Punjabi Ninja,Staunton,"Tea, BBQ, Fast Food, American, Seafood",60,3.0
7572,Radha Swami Cool Hut,Panama City,"Tea, French, Pizza, Seafood",69,3.1
7573,Sagar Choley Bhatoorey,St. Cloud,"Pizza, Fast Food",62,3.2
7574,Sehyog Alpahar,Kona,"Cafe, Mexican, BBQ, Bakery",82,3.2
7575,South Indian Hut,Salina,"Seafood, Pizza, Fast Food",67,2.9
7576,Vijay Corner,Shreveport,"Tea, Pizza, Bakery, Cafe, Indian",19,3.0
7577,Mithlesh Ande Wala,Worcester,"Bakery, Pizza, American",91,3.5
7578,Roti N Boti,Kansas City,"Bakery, Seafood",12,3.5
7579,Annapurna Caters,Dodge City,"Cafe, Mexican, Pizza",40,0.0
7580,Ashoka's Ice Zone,Johnstown,"Tea, Fast Food, Seafood",11,0.0
7581,Bikaner Sweets & Pastry Corner,Johnstown,"Chinese, Bakery, Pizza, Mediterranean",86,0.0
7582,Bikaner Sweets,Dallas,"Bakery, Pizza, Indian, Desserts",33,0.0
7583,Dee Pizza Hub,Bristol,"Mexican, BBQ, Pizza",23,0.0
7584,Flavors of London,Burbank,"Pizza, French, BBQ, Bakery, Fast Food",49,0.0
7585,Funduz Cafe,Milwaukee,"Chinese, Mexican, Desserts, Seafood",40,0.0
7586,Giani,Baton Rouge,"Desserts, Cafe, Fast Food, Chinese, American",75,0.0
