,Name,City,Cuisines,Average Cost,Aggregate Rating
2174,Qureshi's Kabab Corner,Kotzebue,"Desserts, Pizza, Bakery, Fast Food, Indian, Mediterranean",70,3.3
2175,EEST - The Westin Gurgaon,Bismarck,"Tea, Bakery, BBQ, Fast Food, Chinese",97,3.9
2176,Prego - The Westin Gurgaon,Corpus Christi,"Desserts, American, BBQ, Seafood",57,3.8
2177,Seasonal Tastes - The Westin Gurgaon,Hyannis,"Bakery, BBQ",99,3.9
2178,Xiao Chi - The Westin Sohna Resort & Spa,Dodge City,"Cafe, BBQ, Fast Food",69,3.4
2179,The Living Room - The Westin Sohna Resort & Spa,Charleston,"Desserts, Cafe, Pizza, Fast Food, Chinese",26,3.7
2180,The Bar - Trident Gurgaon,Moline,"Pizza, French, BBQ, Fast Food, Indian",48,3.3
2181,Konomi - Trident Gurgaon,Aguadilla,"French, BBQ, Cafe",62,3.5
2182,L'Opera,Miami,"Desserts, Seafood",28,3.7
2183,Town Hall,Shreveport,"Seafood, Pizza, American, Italian",75,3.5
2184,Whisky Samba,Dillingham,"Tea, Pizza, BBQ, Fast Food, Chinese",41,3.8
2185,Chokola,Pasco,"Tea, Pizza, Bakery, American, Seafood",96,3.1
2186,Citrus Cafe - Lemon Tree Hotel,Newport News,"Bakery, Desserts, Seafood",95,2.7
2187,Green Hut,Santa Barbara,"Seafood, Mediterranean, Desserts, Italian",64,2.8
2188,My Plate,Staunton,"Desserts, Tea, Pizza, Chinese, American, Seafood",28,3.1
2189,PiccoLicko,Albany,"Cafe, Pizza, BBQ, Seafood",22,3.3
2190,Pind Balluchi,Grand Junction,"Fast Food, Chinese, Seafood",17,2.7
2191,Raj Xpresso,Dodge City,"Pizza, American, Desserts",29,2.9
2192,Riders Hub,Melbourne,"Tea, BBQ, Fast Food",30,3.1
2193,Shivani Catering Services,Orlando,"Tea, Cafe, Indian, Seafood",75,3.1
2194,The Diet Kitchen,Miami,"Bakery, BBQ, Indian, Mediterranean, Seafood",85,3.3
2195,The Gr8 Taste of India,Nome,"Pizza, Fast Food",69,3.0
2196,World Art Cafe,Eau Claire,"Chinese, BBQ, Seafood",56,3.3
2197,XLNC Bakers,Hilton Head,"Tea, Bakery, Pizza, Desserts",56,2.9
2198,Adventure Food,Santa Rosa,"Pizza, BBQ, Fast Food, Cafe, American",25,0.0
2199,Baba Da Dhaba,Lewiston,"Tea, Pizza, French, BBQ, Chinese",89,0.0
2200,Bandhani Fast Food,Hancock,"Tea, Cafe, Desserts",54,0.0
2201,Bhai Ji Dhaba,Waterloo,"Mexican, Bakery, Desserts",15,0.0
2202,Bikaner Sweets,Gustavus,"Tea, Desserts, Fast Food",18,0.0
2203,Cafe Coffee Day,Moline,"Pizza, French, Fast Food, Cafe, Indian, Seafood",89,0.0
2204,Cake 24x7,Greenville,"Mexican, Bakery, BBQ, Fast Food, Cafe",43,0.0
2205,Chaayos,Binghamton,"Desserts, French, BBQ, Cafe, Mediterranean, Seafood",28,0.0
2206,Chauhan Hotel,Jamestown,"Desserts, Mexican, BBQ, Bakery, Cafe",13,0.0
2207,Costa Coffee,Las Vegas,"Tea, Chinese, American, Seafood",84,0.0
2208,Dheeraj Vaishno Dhaba,Plattsburgh,"Bakery, Indian, Cafe, Seafood",65,0.0
2209,Domino's Pizza,Greer,"Tea, Desserts",12,0.0
2210,Food Ka Adda,Syracuse,"Tea, Indian, American, Fast Food",78,0.0
2211,iKitchen,Tucson,"Seafood, Pizza, Italian",69,0.0
2212,Knights Kitchen,Des Moines,"Tea, Cafe, Indian",29,0.0
2213,Ku-Kukdu-Ku,Gustavus,"Desserts, Cafe, Mexican, Chinese, Seafood",54,0.0
2214,Mogambo Kitchen,Portsmouth,"Desserts, Pizza, Italian, Fast Food, Seafood",85,0.0
2215,Noore-e-Seva,Killeen,"Desserts, Tea, BBQ, Cafe, Mediterranean",12,0.0
2216,Premier Bite,Pellston,"Tea, Bakery, Seafood",53,0.0
2217,Renu Sweets & Restaurant,Harlingen,"Italian, BBQ, Cafe, Indian, Seafood",10,0.0
2218,Street Foods by Punjab Grill,Alamosa,"Pizza, BBQ, Fast Food, Chinese, Mediterranean",55,0.0
2219,Tpot,Charlottesville,"Cafe, Mexican, Bakery, BBQ",35,0.0
2220,Uttrakhand Bohra Bhojnalaya & Fast Food,Paducah,"Desserts, French, Fast Food, Cafe, Mediterranean, Seafood",29,0.0
2221,Uttrakhand Dhaba,Atlantic City,"Tea, Chinese, Pizza, Desserts",29,0.0
2222,Tea Halt,Laredo,"Mexican, Mediterranean, Desserts, Fast Food",54,3.1
2223,Dunkin' Donuts,Hibbing,"Tea, French, Bakery, Cafe",55,3.5
2224,Indian Bistro Company,Aberdeen,"Tea, Chinese, Bakery",16,3.7
2225,Department of Food and Social Affair,International Falls,"Desserts, Italian, Bakery, Fast Food, American",21,0.0
2226,Tpot,Burbank,"Pizza, BBQ",34,0.0
2227,Anaaj,Tulsa,"Tea, Cafe, Bakery, Chinese, Seafood",89,2.9
2228,Au Bon Pain,Daytona Beach,"Tea, Cafe, Pizza, Seafood",85,2.8
2229,Cafe Coffee Day,Bloomington,"Tea, French, Mexican, Cafe, Seafood",29,3.1
2230,Cafe Friends,Santa Rosa,"Tea, Pizza, French, Bakery, Seafood",86,3.2
2231,Chinese Bistro,Bend,"Desserts, Pizza, Italian, Bakery, Cafe, American",92,2.9
2232,Dunkin' Donuts,Honolulu,"Pizza, Desserts",97,3.4
2233,Madras Coffee House,Dothan,"Seafood, Pizza, Fast Food",37,3.0
2234,McDonald's,Deadhorse,"Desserts, Pizza, Bakery, Chinese, Indian",40,3.3
2235,Nukkadwala,Newburgh,"Bakery, Desserts, Seafood",85,3.2
2236,Salad Chef,Worcester,"BBQ, Fast Food",59,3.2
2237,Subway,Abilene,"Fast Food, Tea, Bakery, Italian",57,3.3
2238,Tea Halt,Deadhorse,"Pizza, French, Bakery, Fast Food, Seafood",52,2.7
2239,The Kachori Co.,Redding,"Tea, Mediterranean, Desserts",65,2.5
2240,Urban Dhaba,Birmingham,"Desserts, Italian, Bakery, Fast Food, Indian",25,3.2
2241,A Piece of Paris,New Bern,"Desserts, Pizza, BBQ, Indian, Seafood",58,3.9
2242,Chaayos,Grand Island,"Tea, Cafe, BBQ, Fast Food",62,3.8
2243,Doughlicious,Phoenix,"French, Pizza, BBQ",41,3.6
2244,Eggers Madhouse,Iron Mountain,"Cafe, American, BBQ, Italian",82,3.7
2245,Live Wok,Everett,"Tea, Seafood, Pizza, Fast Food",22,3.6
2246,Orange Chopsticks,Hilo,"Bakery, Pizza",49,3.5
2247,Pizzoccheri,Del Rio,"Cafe, Seafood, Mediterranean, Italian",77,3.6
2248,Creamy Innovation,Santa Fe,"Desserts, Pizza, Fast Food, Cafe, American, Mediterranean",75,0.0
2249,Dosa Republic,Juneau,"Cafe, Pizza, American, Indian",73,0.0
2250,Giani's,Hancock,"Chinese, Mexican, Bakery, Fast Food",22,0.0
2251,Chai Point,Tucson,"Tea, Bakery, Mexican, American",62,2.4
2252,Latitude - Vivanta By Taj,Greer,"Tea, Cafe, Bakery, Desserts",57,3.8
2253,Thai Pavilion - Vivanta By Taj,Watertown,"Desserts, Pizza, Italian, Bakery, BBQ",33,4.0
2254,3H Kitchen,Harlingen,"Tea, Cafe, Desserts",71,2.9
2255,Manish Sweets & Bakers,Asheville,"Chinese, Pizza, Cafe, Desserts",97,2.8
2256,Oasis Kitchen,Fayetteville,"Chinese, Pizza, Desserts",89,2.9
2257,Ramchandra Chinese Food,Lewisburg,"Tea, Italian, Bakery, Fast Food, Cafe, Mediterranean",64,2.7
2258,Sona Chinese,Richmond,"Cafe, Pizza",79,2.8
2259,The Pastry Hut,Jacksonville,"Tea, Pizza, Italian, Bakery, Cafe",82,2.9
2260,Aggarwal Sweets & Restaurant,Peoria,"Seafood, Bakery, Fast Food",17,0.0
2261,Bhoomika,Cody,"Cafe, Bakery, BBQ",99,2.9
2262,FoodZilla,Ontario,"French, Pizza, Indian, Desserts",65,3.3
2263,Goli Vada Pav No. 1,Seattle,"Tea, Bakery, Seafood",31,3.4
2264,Indo Chinese,Bozeman,"Italian, BBQ, Bakery, Fast Food, Chinese, Seafood",66,3.2
2265,Kathi Junction,Jacksonville,"Desserts, Pizza, BBQ, Mediterranean, Seafood",21,3.0
2266,Romi da Dhaba,Belleville,"Desserts, BBQ, Fast Food, Cafe, Indian",24,3.1
2267,Shamji Snacks,Sioux Falls,"Pizza, Indian, BBQ",38,2.7
2268,The Lunch Break,Melbourne,"Cafe, Bakery, BBQ, Fast Food",40,2.9
2269,Veg O Non,Orlando,"BBQ, Mexican, Pizza, Desserts",45,3.1
2270,Alwar Sweets,Corpus Christi,"Tea, Cafe, BBQ, Bakery, Chinese, Mediterranean",12,3.5
2271,Bakers Oven,Tucson,"Bakery, American, Desserts",71,3.6
2272,Burgzz Bee,Rapid City,"Cafe, Mexican, BBQ, Fast Food",32,3.6
2273,Chinese Corner,Santa Fe,"Desserts, Tea, French, Bakery, BBQ",95,3.6
2274,Iroha,Beaumont,"Tea, Mexican, Mediterranean, Seafood",75,3.7
2275,Chaudhary Burfi Wala,White Plains,"French, Pizza, Desserts, Fast Food",19,0.0
2276,Curry 'n' Phulka,Sioux Falls,"Fast Food, Seafood, Desserts, Italian",73,2.4
2277,Wah Ji Wah,Johnstown,"Tea, French, American, Seafood",35,2.2
2278,Woods Spice,Denver,"Tea, Cafe, Mexican, Desserts",69,3.2
2279,Mocha,Tucson,"Cafe, Fast Food",53,4.6
2280,Terra Mayaa Restaurant and Lounge,Providence,"Cafe, Desserts, Italian",80,3.9
2281,The Basement Caf愆,Aguadilla,"BBQ, Seafood",47,4.7
2282,Strawberry Fields,Kalispell,"BBQ, Seafood",22,4.1
2283,Brooklyn Blues,Hancock,"Cafe, Desserts, Fast Food",64,4.2
2284,Confucius,Greer,"Desserts, BBQ, Fast Food, American, Seafood",17,4.1
2285,The Woking Mama,Toledo,"Pizza, French, BBQ, Fast Food, Indian, Seafood",62,4.4
2286,Underdoggs Sports Bar & Grill,Boise,"Tea, Bakery, Pizza, Seafood",93,4.4
2287,The Zouq : Resto-Cafe,Presque Isle,"Tea, Fast Food, American, Seafood",16,4.1
2288,BrewBakes,Kahului,"Desserts, Tea, Mexican, Bakery, Cafe",44,4.0
2289,Barbeque Nation,Madison,"Tea, Pizza, French, Bakery, Cafe",38,4.9
2290,Yo! China,Mission,"Cafe, Mexican, BBQ",11,3.6
2291,4 Seasons,Valdosta,"Tea, Bakery, Pizza",65,3.6
2292,11th Avenue Cafe Bistro,Binghamton,"Tea, Cafe, Mexican, Seafood",44,4.1
2293,Caf愆 Riverrun,Elmira,"Fast Food, Seafood, Italian",24,4.2
2294,Fat Belly,Kahului,"Bakery, BBQ, Cafe, American, Seafood",54,4.1
2295,The Corner Cafe,Vernal,"Cafe, BBQ, Italian",70,4.1
2296,Chung Fa,Gulfport,"Cafe, Mediterranean, Seafood",27,4.3
2297,Shanghai Salsa,Sun Valley,"Desserts, Tea, Bakery, BBQ, Chinese, Mediterranean",78,4.0
2298,Three Guys,Raleigh,"Tea, Pizza, Bakery, BBQ, Mediterranean",31,4.3
2299,Ziya,Fresno,"Fast Food, Seafood, Bakery, Italian",20,4.3
2300,Exotica,Medford,"Pizza, BBQ, Seafood",25,4.3
2301,AB's - Absolute Barbecues,Miami,"Tea, Cafe, Bakery, Fast Food, Chinese",39,4.9
2302,Chili's,Austin,"Cafe, American, Seafood",48,4.7
2303,The Fisherman's Wharf,Valparaiso,"Tea, Cafe",98,3.8
2304,Chili's,Beaumont,"Tea, Cafe, BBQ, Italian",19,4.6
2305,Pine & Dine,Wrangell,"Cafe, American, Desserts",75,4.0
2306,Jonathan's Kitchen - Holiday Inn Express & Suites,Norfolk,"Tea, Seafood, BBQ, Fast Food",44,4.3
2307,AB's - Absolute Barbecues,North Platte,"Pizza, Mexican, Bakery, BBQ, Fast Food",40,4.9
2308,Con韄u,Provo,"BBQ, Desserts, Fast Food",74,4.8
2309,Dock Forty Five,Green Bay,"Cafe, Pizza, Italian",92,4.2
2310,Mocha Bar,Baltimore,"BBQ, Desserts, Italian",32,4.2
2311,Olive Bistro,Plattsburgh,"Cafe, Pizza",88,4.4
2312,Prost Brew Pub,Vernal,"Cafe, Pizza, BBQ, Seafood",70,4.1
2313,United Kitchens of India,Yakima,"BBQ, Mediterranean, Fast Food",26,4.1
2314,Heart Cup Coffee,Yuma,"French, Mexican, Pizza, Seafood",54,4.2
2315,Churrolto,Helena,"Fast Food, American, BBQ, Seafood",12,4.7
2316,The Grand Trunk Road,Abilene,"Tea, Pizza, Bakery, BBQ, Chinese, Mediterranean",80,3.9
2317,Sahib潴籹 Barbeque by Ohri潴籹,Baton Rouge,"Chinese, Pizza, Bakery, BBQ",11,4.1
2318,KYRO,Martha's Vineyard,"Seafood, Bakery, Fast Food",95,3.7
2319,JAL - A Jungle Restaurant,Baltimore,"Mexican, Bakery, Fast Food, Cafe, Seafood",46,4.1
2320,Oye24,Yakutat,"Desserts, Mexican, Bakery, BBQ, American",93,4.1
2321,Hobnob Gourmet Caf愆bar,Saipan,"Mexican, BBQ, Cafe, Indian, Seafood",32,4.1
2322,Mangosteen Cafe,Moab,"Tea, Cafe, Desserts",59,3.9
2323,Mama Loca,Phoenix,"Desserts, Pizza, Italian, Bakery, Fast Food",27,4.2
2324,Vidorra,Traverse City,"Tea, Fast Food",88,4.0
2325,Cafe Palette,Bismarck,"Cafe, BBQ",95,3.8
2326,Nafees Restaurant,Cheyenne,"Italian, Bakery, Fast Food, Cafe, Seafood",33,4.0
2327,The Creative Kitchen - Radisson Blu Hotel,Elmira,"Mexican, Pizza, Seafood",68,3.8
2328,Square - Sayaji Hotel,Harrisburg,"Cafe, Mexican, American, BBQ",99,4.3
2329,Freito,Newburgh,"Pizza, Mexican, Fast Food, Mediterranean, Seafood",84,3.1
2330,Cafe Terazza,Belleville,"BBQ, Pizza, Desserts, Fast Food",50,3.9
2331,Cafe Yolo,Cedar Rapids,"Tea, BBQ, Desserts",12,3.8
2332,Just My Bakes,St. Petersburg,"Pizza, BBQ, Desserts, Seafood",96,3.9
2333,10 Downing Street,Fort Leonard Wood,"Desserts, Tea, Bakery, Cafe, Indian, Mediterranean",62,4.0
2334,Cakesmith's Alley,Beaumont,"Tea, Mexican, BBQ, Fast Food, Mediterranean",61,4.3
2335,The Yellow Chilli,Yakutat,"Tea, Italian, BBQ, Fast Food, Seafood",81,4.1
2336,Waffle House,Latrobe,"Fast Food, Seafood, Bakery, Italian",82,4.3
2337,Mocha,Helena,"Tea, Pizza, Italian, Cafe, American, Seafood",38,4.0
2338,Tapri Central,West Palm Beach,"Bakery, Seafood",33,4.7
2339,Blackout,Texarkana,"Tea, Desserts, Fast Food",68,3.9
2340,Mamu's Infusion,Colorado Springs,"Tea, BBQ",42,4.0
2341,Nibs Cafe,Worcester,"Bakery, Pizza, Desserts",63,4.4
2342,On The House,Pasco,"Seafood, Desserts, Italian",36,4.4
2343,WTF,Kalispell,"Tea, Bakery, American, Fast Food",88,4.0
2344,Chokhi Dhani,Newburgh,"Tea, Chinese, Pizza, Desserts",68,4.3
2345,Meraaki Kitchen,Brunswick,"Bakery, Fast Food",97,3.9
2346,Taruveda Bistro,Great Falls,"Chinese, Pizza, BBQ, Seafood",27,4.2
2347,The Forresta Kitchen & Bar,Sioux City,"BBQ, Mediterranean, Desserts, Seafood",51,4.0
2348,Monarch Restaurant - Holiday Inn Jaipur City Centre,Medford,"BBQ, Fast Food",83,4.5
2349,Chao Chinese Bistro - Holiday Inn Jaipur City Centre,Bemidji,"Fast Food, Seafood",22,4.3
2350,Zolocrust - Hotel Clarks Amer,Burbank,"Cafe, BBQ, Seafood, Fast Food",94,4.9
2351,Mutual's,Latrobe,"Cafe, Pizza, Mediterranean, Fast Food",33,4.2
2352,O2- The Plant Cafe,Harlingen,"Cafe, Pizza, Bakery, Desserts",48,4.1
2353,Cafe LazyMojo,Alamosa,"Tea, Pizza, American, Fast Food",26,4.3
2354,Replay,Panama City,"Tea, Cafe, Desserts, Seafood",62,4.3
2355,Sky Beach,Pellston,"Bakery, Pizza, Seafood",37,2.6
2356,Decked Up By Garden Cafe,Manhattan,"Pizza, Indian, BBQ",65,3.9
2357,Calzone- Dine & Rooftop Lounge,Lexington,"Tea, Cafe, BBQ, Desserts",100,3.7
2358,Hucka,Moline,"Desserts, Tea, Pizza, Fast Food, American",29,3.3
2359,The Zaffran,Tampa,"Tea, Bakery, Fast Food, American, Seafood",35,3.3
2360,Gyan Vaishnav,Chicago,"Bakery, Desserts",14,3.9
2361,Liquid,Chattanooga,"Tea, Pizza, Bakery, Mediterranean, Seafood",15,4.0
2362,Royal Dine - Hotel Royal Cliff,Arcata,"Pizza, Bakery, BBQ, Seafood",78,4.0
2363,Urban Crave Express,Alamosa,"Desserts, French, Bakery, Fast Food, Cafe",38,3.5
2364,Atmosphere Grill Cafe Sheesha,Everett,"Seafood, Cafe, Italian",84,3.6
2365,Mr Brown,Des Moines,"BBQ, Fast Food",13,3.9
2366,Dunkin Donuts,Gulfport,"Cafe, Pizza, Indian, Desserts",74,4.1
2367,Little Chef,Ithaca,"Chinese, Pizza, BBQ",12,4.1
2368,UrbanCrave,Savannah,"Tea, Cafe, Indian, BBQ",64,3.9
2369,Chin Mi,Kotzebue,"Tea, French, Bakery, Seafood",33,3.9
2370,Tadka,Hilton Head,"Pizza, Bakery, Desserts, Seafood",44,3.8
2371,Dhuaan,Idaho Falls,"Tea, Pizza, Mexican, BBQ, Fast Food, American",97,4.3
2372,Upper Crust,Eugene,"Tea, Pizza, Italian, Cafe, Seafood",79,3.4
2373,Anaicha's Food Joint,Newark,"Desserts, Pizza, Mexican, Bakery, Seafood",43,3.6
2374,Aromas,Indianapolis,"Bakery, Seafood",34,4.1
2375,Waterside - The Landmark Hotel,Wrangell,"Desserts, Tea, Italian, Bakery, Cafe",93,3.9
2376,Verandah,Laredo,"Desserts, Tea, Fast Food, Chinese, American",28,3.7
2377,Barbeque Nation,Dothan,"Indian, BBQ, Fast Food",39,4.0
2378,Nawras Seafood Restaurant,Santa Ana,"Tea, Bakery, Desserts",83,4.6
2379,Ifthar,Marquette,"Bakery, American, Cafe, Desserts",67,3.8
2380,Dhe Puttu,Ogdensburg,"Tea, BBQ, Seafood",55,4.4
2381,Kashi Art Cafe,Lansing,"Tea, Pizza, BBQ, Bakery, Chinese",83,4.2
2382,Grand Hotel Restaurant,Bishop,"Fast Food, Pizza, BBQ, Italian",10,4.2
2383,Barbeque Nation,Brownsville,"French, BBQ, Fast Food",45,4.5
2384,Chiyang,Medford,"Tea, BBQ, Seafood",10,3.7
2385,Slice of Spice,Peoria,"Tea, Fast Food",85,4.0
2386,Mustake Multicuisine Restaurant,Reno,"Tea, Bakery, Pizza, Mediterranean",91,3.7
2387,Palaaram,Palm Springs,"Desserts, Pizza, Italian, BBQ, Cafe",63,3.7
2388,Tonico Cafe,Bishop,"Desserts, Tea, American, Mediterranean, Seafood",75,4.0
2389,Cafe 17,Miami,"Tea, BBQ, Bakery, Desserts",45,4.4
2390,ChaiCofi,Manchester,"Desserts, Seafood",35,4.0
2391,Bloomsbury's Boutique Cafe and Artisan Bakery,Redding,"Pizza, Indian, BBQ",59,4.2
2392,Paragon,Alexandria,"Pizza, Bakery",50,4.3
2393,Aangan - Downtown Multicuisine Restaurant,Cincinnati,"Tea, Indian, Desserts",21,4.2
2394,Ali Baba & 41 Dishes,Knoxville,"Pizza, Desserts, Fast Food",70,3.5
2395,Cocoa Tree,Grand Junction,"Tea, Chinese, Cafe, Fast Food",68,4.3
2396,French Toast,Traverse City,"Pizza, Desserts",18,4.3
2397,Thakkaaram,Fort Lauderdale,"Tea, Mexican, Fast Food",48,3.6
2398,Asia Kitchen by Mainland China,Ogden,"Seafood, Mediterranean, Desserts, Fast Food",81,4.6
2399,Hoppipola,Mission,"Desserts, Tea, Italian, Fast Food, Cafe, American",96,4.2
2400,Spice Kraft,Moab,"Tea, Pizza, Desserts, Italian",94,4.8
2401,Nawwarah,Buffalo,"Cafe, Seafood",34,3.9
2402,6 Ballygunge Place,San Angelo,"Tea, Cafe, Bakery, Desserts",48,4.4
2403,Mumbai Local,Redding,"Bakery, Pizza, BBQ, Desserts",78,4.2
2404,Gabbar's Bar & Kitchen,West Yellowstone,"Seafood, Bakery, Fast Food",89,4.4
2405,TGI Friday's,Pago Pago,"French, BBQ, Seafood",79,4.0
2406,Santa's Fantasea,San Jose,"Cafe, Bakery, Pizza, BBQ",31,4.2
2407,India Restaurant,Ithaca,"Tea, BBQ, Desserts",78,4.6
2408,Flame & Grill,Pellston,"Bakery, BBQ",23,3.9
2409,Barbeque Nation,Daytona Beach,"Tea, American, Fast Food, Indian, Seafood",40,4.9
2410,Mocambo,Phoenix,"Tea, Chinese, Desserts, Fast Food",76,3.5
2411,BarBQ,Juneau,"Tea, Pizza, BBQ, Fast Food, Mediterranean",25,4.2
2412,Peter Cat,Iron Mountain,"French, Bakery, American, Desserts",56,4.3
2413,The Irish House,Columbus,"Desserts, Tea, Pizza, Mexican, Fast Food, Mediterranean",65,4.4
2414,Barbeque Nation,Sun Valley,"Tea, Bakery, BBQ, Desserts",22,4.9
2415,Ocean Grill,Cincinnati,"Tea, Mexican, BBQ, Cafe, Mediterranean, Seafood",62,3.6
2416,Sigree Global Grill,Amarillo,"Chinese, BBQ, Cafe, Desserts",35,4.1
2417,What's Up,San Luis Obispo,"Desserts, Mexican, BBQ, Bakery, Cafe",86,4.0
2418,Grandson of Tunday Kababi,Madison,"Fast Food, Bakery, American, Seafood",36,4.9
2419,Frozen Factory,Presque Isle,"Mediterranean, Desserts, Fast Food",19,4.5
2420,Mocha,Saipan,"Pizza, Bakery, BBQ, Fast Food",46,4.6
2421,Chemistry Caf愆,Yakutat,"Bakery, Mediterranean, Fast Food",67,3.5
2422,Homeys Cafe,Portsmouth,"Tea, French, Desserts",43,3.9
2423,Percussion,Grand Forks,"Pizza, Italian, BBQ, Fast Food, Seafood",21,3.7
2424,The Urban Terrace,Scottsbluff,"Italian, Bakery, BBQ, Mediterranean, Seafood",56,3.9
2425,Free Spirit,San Jose,"Mexican, Bakery, BBQ, Fast Food, Seafood",17,4.3
2426,Spice Caves,Elmira,"Desserts, Tea, Mexican, Bakery, Chinese",52,4.2
2427,The Chocolate Heaven,State College,"Pizza, BBQ",45,4.1
2428,The Pebbles Bistro,Omaha,"Fast Food, Mexican, Pizza, Seafood",13,4.1
2429,Underdoggs Sports Bar & Grill,Colorado Springs,"Cafe, Mexican, Desserts",32,4.3
2430,Vintage Machine,West Yellowstone,"Desserts, Tea, Italian, Bakery, Mediterranean",52,4.3
2431,Bar Bar,Roanoke,"Chinese, Cafe, Seafood",30,4.0
2432,Dastarkhwan,Johnstown,"Tea, Mexican, Pizza",100,4.4
2433,The Cherry Tree Cafe,Mission,"Cafe, Bakery",70,4.1
2434,Royal Sky,Presque Isle,"Desserts, Italian, Bakery, Fast Food, Indian",15,4.2
2435,L 14 - Renaissance Lucknow Hotel,Victoria,"Chinese, BBQ, Desserts",23,4.2
2436,Barbeque Nation,Bristol,"Desserts, Tea, Italian, Bakery, Fast Food, Indian",42,4.7
2437,Colours by Royal Cafe - Royal Inn,Little Rock,"Bakery, Indian, Cafe, Fast Food",31,4.2
2438,Cappuccino Blast,Oklahoma City,"Cafe, Bakery, American, Seafood",84,4.0
2439,Basant Restaurant,Yuma,"Desserts, Pizza, Fast Food, Cafe, American",53,3.6
2440,Hawai Adda,Newark,"Tea, Pizza, Desserts",17,3.5
2441,Indian Summer,Elmira,"Mexican, Pizza, Desserts, Italian",29,4.1
2442,Basant,Kansas City,"Fast Food, Pizza, BBQ, Seafood",98,3.9
2443,Bistro 226,North Bend,"Tea, Cafe, Bakery, BBQ, Chinese",16,4.2
2444,Mocha,St. Cloud,"American, Desserts, Fast Food",80,3.7
2445,Pirates Of Grill,Lynchburg,"Tea, Pizza, American, Seafood",71,3.9
2446,Bistro Flamme Bois,Detroit,"Chinese, Bakery, BBQ",100,4.1
2447,Kitchen At 95 - Hyatt Regency,St. Petersburg,"Cafe, Desserts, Seafood",14,4.3
2448,Domino's Pizza,Bakersfield,"Pizza, Mediterranean, Desserts",19,3.6
2449,Nando's,Manchester,"Bakery, Indian, BBQ",56,3.8
2450,Belfrance Luxury Chocolates,Dallas,"Desserts, Pizza, Fast Food, Cafe, American",96,4.4
2451,Hot Breads,Eau Claire,"Tea, Mexican, Bakery, BBQ, Indian",91,4.2
2452,The Yellow Chilli,Juneau,"Italian, Bakery, BBQ, Fast Food, Seafood",28,4.4
2453,Spice Cube,Beaumont,"Cafe, Pizza, Bakery, Desserts",17,3.5
2454,Barbeque Nation,Aguadilla,"BBQ, Mediterranean, Desserts, Fast Food",79,3.9
2455,Nik Bakers,Concord,"Cafe, Seafood, Mediterranean, Fast Food",56,4.2
2456,Aman Chicken,Latrobe,"Tea, Pizza, Desserts, Seafood",57,4.6
2457,District 6,San Angelo,"Bakery, American, Cafe, BBQ",19,3.8
2458,The BrewMaster - The Mix Fine Dine,Houston,"French, Indian, Cafe, Seafood",52,3.9
2459,#45,Santa Maria,"Tea, Bakery, BBQ, Seafood",14,3.6
2460,Crave Desserts & Bakes,Redding,"Cafe, Desserts, Seafood",98,3.9
2461,Diesel Cafe,Midland,"French, Pizza, Cafe",37,3.8
2462,Froth On Top,Muskegon,"Tea, Cafe, Italian, Fast Food, Chinese, Seafood",10,3.7
2463,Hao Ming,Palm Springs,"Tea, Cafe, Desserts, Fast Food",29,3.5
2464,Kobe Sizzlers,Jacksonville,"Pizza, Indian, Fast Food",93,3.7
2465,Liquid Lounge,Duluth,"Cafe, Mediterranean, Seafood",50,3.8
2466,Maharaja Restaurant,Charlotte Amalie,"French, BBQ, Fast Food, Cafe, Mediterranean",59,3.6
2467,Giri Manja's,Green Bay,"French, Seafood, Cafe, Italian",67,4.2
2468,Kabab Studio,Deadhorse,"Tea, French, Bakery, Seafood",46,3.5
2469,Brio Cafe and Grill,Martha's Vineyard,"Pizza, French, Bakery, Cafe, Mediterranean",56,3.6
2470,Gajalee Sea Food,Rockford,"Bakery, BBQ",49,3.9
2471,Smoke N Oven,Fayetteville,"Desserts, Cafe, Pizza, Fast Food, Chinese",26,3.5
2472,Village Restaurant,Phoenix,"Tea, Cafe, Desserts, Italian",35,3.7
2473,Barbeque Nation,Peoria,"Desserts, Tea, Pizza, Italian, Indian, Seafood",64,3.7
2474,Machali,Ontario,"Cafe, Bakery, Desserts, Fast Food",52,4.1
2475,Punjab Da Pind,Grand Junction,"Desserts, Pizza, Bakery, Chinese, Mediterranean, Seafood",52,3.7
2476,Sizzler's Ranch,Atlanta,"Tea, Cafe, Indian, Italian",36,3.8
2477,Spindrift,Hartford,"Tea, French, Bakery, BBQ, Chinese",46,3.9
2478,Sagar Ratna,Rochester,"Cafe, Bakery, Indian",88,3.7
2479,The Shooters Cafe,Cheyenne,"Cafe, BBQ, Desserts, Fast Food",83,4.3
2480,Joey's Pizza,Decatur,"Tea, Pizza, Bakery, Chinese, Seafood",69,4.0
2481,Cafe Hydro,Moab,"Pizza, BBQ, Fast Food, American, Seafood",21,4.0
2482,The American Joint,Santa Rosa,"Mexican, Desserts, Seafood",78,3.4
2483,The Fusion Kitchen,Manchester,"Bakery, Pizza, Mediterranean, BBQ",39,4.7
2484,145 Kala Ghoda,Mission,"Tea, Seafood, Mexican, Fast Food",83,4.2
2485,Tea Villa Cafe,Dubuque,"Tea, Pizza, French, Bakery, BBQ",92,4.1
2486,Grandmama's Cafe,Green Bay,"Desserts, American, BBQ, Fast Food, Cafe, Indian",20,3.8
2487,Mumbai Vibe,Santa Ana,"Desserts, Tea, French, Mexican, Fast Food, Cafe",38,3.8
2488,The Rolling Pin,Latrobe,"Bakery, Pizza, Fast Food",28,3.9
2489,Farzi Cafe,Presque Isle,"Tea, Mexican, Bakery, Fast Food",83,4.3
2490,SpiceKlub,Roswell,"Tea, Bakery",20,4.2
2491,Tea Villa Cafe,Montgomery,"BBQ, Mediterranean, Desserts, Fast Food",51,3.9
2492,Joey's Pizza,Salt Lake City,"Cafe, Desserts, American, BBQ",28,4.5
2493,Stacks And Racks,Newport News,"Tea, Seafood, BBQ, Fast Food",65,4.6
2494,The English Department Bar & Diner,Wrangell,"Tea, Pizza, BBQ, Indian, Seafood",62,3.9
2495,Mirchi And Mime,Arcata,"Desserts, Tea, Mexican, BBQ, Cafe, American",35,4.9
2496,38 Degree East,Sault Ste. Marie,"Desserts, Tea, French, Bakery, Seafood",48,3.8
2497,R' ADDA,San Luis Obispo,"Desserts, Fast Food",19,4.0
2498,Tea Villa Cafe,Green Bay,"Desserts, Italian, Bakery, BBQ, Fast Food",22,4.1
2499,Tea Villa Cafe,Fort Dodge,"Tea, BBQ, Fast Food, American, Seafood",75,3.6
2500,Hotel RRR Mysore,Charleston,"Cafe, Pizza, BBQ, Bakery",43,3.4
2501,Jalpaan Dining Saga,Prescott,"Cafe, BBQ, Desserts",95,3.7
2502,The Old House,Redding,"Bakery, Seafood",78,3.9
2503,Vinayaka Mylari,Houston,"Fast Food, French, Cafe, Italian",14,4.2
2504,Empire Restaurant,Green Bay,"Cafe, Pizza, American, Fast Food",97,3.7
2505,Green Leaf,Mission,"Desserts, BBQ, Fast Food, Cafe, Indian",67,3.5
2506,Pakva Lounge,Bend,"Pizza, Mediterranean, Desserts",46,3.7
2507,Spring - Radisson Blu Plaza,Ponce,"Seafood, Bakery, Italian",64,3.8
2508,Big Chicken,Cleveland,"Cafe, Pizza, Bakery, Italian",27,3.5
2509,Barbeque Nation,Las Vegas,"Desserts, Tea, Italian, Fast Food, American, Seafood",88,4.0
2510,Pizza Hut,Bishop,"Mexican, Bakery, BBQ, Fast Food",31,4.0
2511,Tandooriwala,Medford,"Desserts, Pizza, Mexican, Cafe, American",58,3.5
2512,Jungle The Restaurant,Phoenix,"Desserts, Seafood",27,3.7
2513,The Barge Restaurant,Jackson,"Tea, Pizza, Mediterranean",18,3.3
2514,By The Way,Tallahassee,"Desserts, Pizza, Bakery, Mediterranean, Seafood",46,3.6
2515,Cafe Cornucopia,Wichita,"Tea, Cafe, Bakery",76,3.6
2516,Mezzaluna,Syracuse,"Pizza, Indian, Desserts, Fast Food",41,3.8
2517,Nanking,Cody,"Tea, Italian, Fast Food, Indian, Seafood",44,3.7
2518,Oyster Bay,North Bend,"Cafe, Bakery, Desserts, Seafood",61,3.6
2519,Purple Haze,Sault Ste. Marie,"French, Desserts, Fast Food",39,3.7
2520,House of Caffeine,Minot,"Seafood, Mexican, American, Fast Food",97,3.3
2521,Hide Out The Street Cafe,Punta Gorda,"Desserts, BBQ, Fast Food, Chinese, Seafood",92,3.8
2522,Tapri The Chai Books Cafe,Gainesville,"Bakery, Mediterranean, BBQ, Fast Food",62,3.9
2523,Eat Street Express,Myrtle Beach,"Fast Food, Pizza, BBQ, Italian",100,4.0
2524,Zaikart,Butte,"Tea, Pizza, American",33,4.3
2525,Cafe Zinea,Ontario,"Italian, Bakery, BBQ, Fast Food, Cafe",31,3.7
2526,Checker's,Syracuse,"Tea, Italian, French, Fast Food, Cafe",90,4.0
2527,The B.A.W.A,Wichita,"Tea, Chinese, Pizza, BBQ",23,4.2
2528,FSB,Santa Ana,"Desserts, Bakery, BBQ, Cafe, American",87,4.3
2529,NESCAF韸 Illusions,Moab,"Tea, Desserts",24,3.9
2530,Nineties,Cleveland,"Cafe, Pizza, Desserts",31,3.9
2531,Mocha,Memphis,"Cafe, Mexican, BBQ",57,4.0
2532,The Zuree Urban Kitchen,Buffalo,"Fast Food, Seafood, Italian",50,4.4
2533,The Breakfast Story,Manchester,"Bakery, Mexican, Pizza, Desserts",41,4.5
2534,Ten Downing Street Restaurant & Bar,Valparaiso,"Tea, Pizza, BBQ, Seafood",46,4.0
2535,Ashoka Restaurant,Ithaca,"Tea, Fast Food",47,4.2
2536,Barbeque Nation,Cheyenne,"Tea, French, BBQ, Fast Food, Seafood",64,4.9
2537,KFC,Cedar City,"Tea, Cafe, Seafood, Fast Food",13,2.2
2538,Moksh The Restro Lounge,Huntsville,"Pizza, American, BBQ, Fast Food, Indian",77,4.0
2539,Mainland China,Salt Lake City,"Tea, Cafe, Mexican, Seafood",79,3.8
